
         /\      Grafana   /‾‾/  
    /\  /  \     |\  __   /  /   
   /  \/    \    | |/ /  /   ‾‾\ 
  /          \   |   (  |  (‾)  |
 / __________ \  |_|\_\  \_____/ 


     execution: local
        script: /k6/k6/submit-soak.js
        output: -

     scenarios: (100.00%) 1 scenario, 120 max VUs, 2m30s max duration (incl. graceful stop):
              * soak: 40.00 iterations/s for 2m0s (maxVUs: 40-120, gracefulStop: 30s)


running (0m00.9s), 002/040 VUs, 36 complete and 0 interrupted iterations
soak   [   1% ] 002/040 VUs  0m00.9s/2m0s  40.00 iters/s

running (0m01.9s), 001/040 VUs, 77 complete and 0 interrupted iterations
soak   [   2% ] 001/040 VUs  0m01.9s/2m0s  40.00 iters/s

running (0m02.9s), 001/040 VUs, 117 complete and 0 interrupted iterations
soak   [   2% ] 001/040 VUs  0m02.9s/2m0s  40.00 iters/s

running (0m03.9s), 001/040 VUs, 157 complete and 0 interrupted iterations
soak   [   3% ] 001/040 VUs  0m03.9s/2m0s  40.00 iters/s

running (0m04.9s), 002/040 VUs, 196 complete and 0 interrupted iterations
soak   [   4% ] 002/040 VUs  0m04.9s/2m0s  40.00 iters/s

running (0m05.9s), 001/040 VUs, 237 complete and 0 interrupted iterations
soak   [   5% ] 001/040 VUs  0m05.9s/2m0s  40.00 iters/s

running (0m06.9s), 001/040 VUs, 277 complete and 0 interrupted iterations
soak   [   6% ] 001/040 VUs  0m06.9s/2m0s  40.00 iters/s

running (0m07.9s), 003/040 VUs, 315 complete and 0 interrupted iterations
soak   [   7% ] 003/040 VUs  0m07.9s/2m0s  40.00 iters/s

running (0m08.9s), 001/040 VUs, 357 complete and 0 interrupted iterations
soak   [   7% ] 001/040 VUs  0m08.9s/2m0s  40.00 iters/s

running (0m09.9s), 001/040 VUs, 397 complete and 0 interrupted iterations
soak   [   8% ] 001/040 VUs  0m09.9s/2m0s  40.00 iters/s

running (0m10.9s), 001/040 VUs, 437 complete and 0 interrupted iterations
soak   [   9% ] 001/040 VUs  0m10.9s/2m0s  40.00 iters/s

running (0m11.9s), 001/040 VUs, 477 complete and 0 interrupted iterations
soak   [  10% ] 001/040 VUs  0m11.9s/2m0s  40.00 iters/s

running (0m12.9s), 001/040 VUs, 517 complete and 0 interrupted iterations
soak   [  11% ] 001/040 VUs  0m12.9s/2m0s  40.00 iters/s

running (0m13.9s), 002/040 VUs, 556 complete and 0 interrupted iterations
soak   [  12% ] 002/040 VUs  0m13.9s/2m0s  40.00 iters/s

running (0m14.9s), 003/040 VUs, 595 complete and 0 interrupted iterations
soak   [  12% ] 003/040 VUs  0m14.9s/2m0s  40.00 iters/s

running (0m15.9s), 005/040 VUs, 633 complete and 0 interrupted iterations
soak   [  13% ] 005/040 VUs  0m15.9s/2m0s  40.00 iters/s

running (0m16.9s), 002/040 VUs, 676 complete and 0 interrupted iterations
soak   [  14% ] 002/040 VUs  0m16.9s/2m0s  40.00 iters/s

running (0m17.9s), 001/040 VUs, 717 complete and 0 interrupted iterations
soak   [  15% ] 001/040 VUs  0m17.9s/2m0s  40.00 iters/s

running (0m18.9s), 001/040 VUs, 757 complete and 0 interrupted iterations
soak   [  16% ] 001/040 VUs  0m18.9s/2m0s  40.00 iters/s

running (0m19.9s), 001/040 VUs, 797 complete and 0 interrupted iterations
soak   [  17% ] 001/040 VUs  0m19.9s/2m0s  40.00 iters/s

running (0m20.9s), 001/040 VUs, 837 complete and 0 interrupted iterations
soak   [  17% ] 001/040 VUs  0m20.9s/2m0s  40.00 iters/s

running (0m21.9s), 001/040 VUs, 877 complete and 0 interrupted iterations
soak   [  18% ] 001/040 VUs  0m21.9s/2m0s  40.00 iters/s

running (0m22.9s), 002/040 VUs, 916 complete and 0 interrupted iterations
soak   [  19% ] 002/040 VUs  0m22.9s/2m0s  40.00 iters/s

running (0m23.9s), 001/040 VUs, 957 complete and 0 interrupted iterations
soak   [  20% ] 001/040 VUs  0m23.9s/2m0s  40.00 iters/s

running (0m24.9s), 004/040 VUs, 994 complete and 0 interrupted iterations
soak   [  21% ] 004/040 VUs  0m24.9s/2m0s  40.00 iters/s

running (0m25.9s), 001/040 VUs, 1037 complete and 0 interrupted iterations
soak   [  22% ] 001/040 VUs  0m25.9s/2m0s  40.00 iters/s

running (0m26.9s), 001/040 VUs, 1077 complete and 0 interrupted iterations
soak   [  22% ] 001/040 VUs  0m26.9s/2m0s  40.00 iters/s

running (0m27.9s), 001/040 VUs, 1117 complete and 0 interrupted iterations
soak   [  23% ] 001/040 VUs  0m27.9s/2m0s  40.00 iters/s

running (0m28.9s), 001/040 VUs, 1157 complete and 0 interrupted iterations
soak   [  24% ] 001/040 VUs  0m28.9s/2m0s  40.00 iters/s

running (0m29.9s), 001/040 VUs, 1197 complete and 0 interrupted iterations
soak   [  25% ] 001/040 VUs  0m29.9s/2m0s  40.00 iters/s

running (0m30.9s), 001/040 VUs, 1237 complete and 0 interrupted iterations
soak   [  26% ] 001/040 VUs  0m30.9s/2m0s  40.00 iters/s

running (0m31.9s), 002/040 VUs, 1276 complete and 0 interrupted iterations
soak   [  27% ] 002/040 VUs  0m31.9s/2m0s  40.00 iters/s

running (0m32.9s), 003/040 VUs, 1315 complete and 0 interrupted iterations
soak   [  27% ] 003/040 VUs  0m32.9s/2m0s  40.00 iters/s

running (0m33.9s), 001/040 VUs, 1357 complete and 0 interrupted iterations
soak   [  28% ] 001/040 VUs  0m33.9s/2m0s  40.00 iters/s

running (0m34.9s), 001/040 VUs, 1397 complete and 0 interrupted iterations
soak   [  29% ] 001/040 VUs  0m34.9s/2m0s  40.00 iters/s

running (0m35.9s), 001/040 VUs, 1437 complete and 0 interrupted iterations
soak   [  30% ] 001/040 VUs  0m35.9s/2m0s  40.00 iters/s

running (0m36.9s), 002/040 VUs, 1476 complete and 0 interrupted iterations
soak   [  31% ] 002/040 VUs  0m36.9s/2m0s  40.00 iters/s

running (0m37.9s), 001/040 VUs, 1517 complete and 0 interrupted iterations
soak   [  32% ] 001/040 VUs  0m37.9s/2m0s  40.00 iters/s

running (0m38.9s), 001/040 VUs, 1557 complete and 0 interrupted iterations
soak   [  32% ] 001/040 VUs  0m38.9s/2m0s  40.00 iters/s

running (0m39.9s), 005/040 VUs, 1593 complete and 0 interrupted iterations
soak   [  33% ] 005/040 VUs  0m39.9s/2m0s  40.00 iters/s

running (0m40.9s), 001/040 VUs, 1637 complete and 0 interrupted iterations
soak   [  34% ] 001/040 VUs  0m40.9s/2m0s  40.00 iters/s

running (0m41.9s), 001/040 VUs, 1677 complete and 0 interrupted iterations
soak   [  35% ] 001/040 VUs  0m41.9s/2m0s  40.00 iters/s

running (0m42.9s), 001/040 VUs, 1717 complete and 0 interrupted iterations
soak   [  36% ] 001/040 VUs  0m42.9s/2m0s  40.00 iters/s

running (0m43.9s), 001/040 VUs, 1757 complete and 0 interrupted iterations
soak   [  37% ] 001/040 VUs  0m43.9s/2m0s  40.00 iters/s

running (0m44.9s), 001/040 VUs, 1797 complete and 0 interrupted iterations
soak   [  37% ] 001/040 VUs  0m44.9s/2m0s  40.00 iters/s

running (0m45.9s), 001/040 VUs, 1837 complete and 0 interrupted iterations
soak   [  38% ] 001/040 VUs  0m45.9s/2m0s  40.00 iters/s

running (0m46.9s), 003/040 VUs, 1875 complete and 0 interrupted iterations
soak   [  39% ] 003/040 VUs  0m46.9s/2m0s  40.00 iters/s

running (0m47.9s), 001/040 VUs, 1917 complete and 0 interrupted iterations
soak   [  40% ] 001/040 VUs  0m47.9s/2m0s  40.00 iters/s

running (0m48.9s), 001/040 VUs, 1957 complete and 0 interrupted iterations
soak   [  41% ] 001/040 VUs  0m48.9s/2m0s  40.00 iters/s

running (0m49.9s), 001/040 VUs, 1997 complete and 0 interrupted iterations
soak   [  42% ] 001/040 VUs  0m49.9s/2m0s  40.00 iters/s

running (0m50.9s), 001/040 VUs, 2037 complete and 0 interrupted iterations
soak   [  42% ] 001/040 VUs  0m50.9s/2m0s  40.00 iters/s

running (0m51.9s), 001/040 VUs, 2077 complete and 0 interrupted iterations
soak   [  43% ] 001/040 VUs  0m51.9s/2m0s  40.00 iters/s

running (0m52.9s), 001/040 VUs, 2117 complete and 0 interrupted iterations
soak   [  44% ] 001/040 VUs  0m52.9s/2m0s  40.00 iters/s

running (0m53.9s), 001/040 VUs, 2157 complete and 0 interrupted iterations
soak   [  45% ] 001/040 VUs  0m53.9s/2m0s  40.00 iters/s

running (0m54.9s), 002/040 VUs, 2196 complete and 0 interrupted iterations
soak   [  46% ] 002/040 VUs  0m54.9s/2m0s  40.00 iters/s

running (0m55.9s), 002/040 VUs, 2236 complete and 0 interrupted iterations
soak   [  47% ] 002/040 VUs  0m55.9s/2m0s  40.00 iters/s

running (0m56.9s), 006/040 VUs, 2272 complete and 0 interrupted iterations
soak   [  47% ] 006/040 VUs  0m56.9s/2m0s  40.00 iters/s

running (0m57.9s), 002/040 VUs, 2316 complete and 0 interrupted iterations
soak   [  48% ] 002/040 VUs  0m57.9s/2m0s  40.00 iters/s

running (0m58.9s), 001/040 VUs, 2357 complete and 0 interrupted iterations
soak   [  49% ] 001/040 VUs  0m58.9s/2m0s  40.00 iters/s

running (0m59.9s), 002/040 VUs, 2396 complete and 0 interrupted iterations
soak   [  50% ] 002/040 VUs  0m59.9s/2m0s  40.00 iters/s

running (1m00.9s), 001/040 VUs, 2437 complete and 0 interrupted iterations
soak   [  51% ] 001/040 VUs  1m00.9s/2m0s  40.00 iters/s

running (1m01.9s), 002/040 VUs, 2476 complete and 0 interrupted iterations
soak   [  52% ] 002/040 VUs  1m01.9s/2m0s  40.00 iters/s

running (1m02.9s), 001/040 VUs, 2517 complete and 0 interrupted iterations
soak   [  52% ] 001/040 VUs  1m02.9s/2m0s  40.00 iters/s

running (1m03.9s), 003/040 VUs, 2555 complete and 0 interrupted iterations
soak   [  53% ] 003/040 VUs  1m03.9s/2m0s  40.00 iters/s

running (1m04.9s), 001/040 VUs, 2597 complete and 0 interrupted iterations
soak   [  54% ] 001/040 VUs  1m04.9s/2m0s  40.00 iters/s

running (1m05.9s), 003/040 VUs, 2635 complete and 0 interrupted iterations
soak   [  55% ] 003/040 VUs  1m05.9s/2m0s  40.00 iters/s

running (1m06.9s), 001/040 VUs, 2677 complete and 0 interrupted iterations
soak   [  56% ] 001/040 VUs  1m06.9s/2m0s  40.00 iters/s

running (1m07.9s), 001/040 VUs, 2717 complete and 0 interrupted iterations
soak   [  57% ] 001/040 VUs  1m07.9s/2m0s  40.00 iters/s

running (1m08.9s), 001/040 VUs, 2757 complete and 0 interrupted iterations
soak   [  57% ] 001/040 VUs  1m08.9s/2m0s  40.00 iters/s

running (1m09.9s), 001/040 VUs, 2797 complete and 0 interrupted iterations
soak   [  58% ] 001/040 VUs  1m09.9s/2m0s  40.00 iters/s

running (1m10.9s), 001/040 VUs, 2837 complete and 0 interrupted iterations
soak   [  59% ] 001/040 VUs  1m10.9s/2m0s  40.00 iters/s

running (1m11.9s), 001/040 VUs, 2877 complete and 0 interrupted iterations
soak   [  60% ] 001/040 VUs  1m11.9s/2m0s  40.00 iters/s

running (1m12.9s), 003/040 VUs, 2915 complete and 0 interrupted iterations
soak   [  61% ] 003/040 VUs  1m12.9s/2m0s  40.00 iters/s

running (1m13.9s), 002/040 VUs, 2956 complete and 0 interrupted iterations
soak   [  62% ] 002/040 VUs  1m13.9s/2m0s  40.00 iters/s

running (1m14.9s), 001/040 VUs, 2997 complete and 0 interrupted iterations
soak   [  62% ] 001/040 VUs  1m14.9s/2m0s  40.00 iters/s

running (1m15.9s), 001/040 VUs, 3037 complete and 0 interrupted iterations
soak   [  63% ] 001/040 VUs  1m15.9s/2m0s  40.00 iters/s

running (1m16.9s), 001/040 VUs, 3077 complete and 0 interrupted iterations
soak   [  64% ] 001/040 VUs  1m16.9s/2m0s  40.00 iters/s

running (1m17.9s), 001/040 VUs, 3117 complete and 0 interrupted iterations
soak   [  65% ] 001/040 VUs  1m17.9s/2m0s  40.00 iters/s

running (1m18.9s), 001/040 VUs, 3157 complete and 0 interrupted iterations
soak   [  66% ] 001/040 VUs  1m18.9s/2m0s  40.00 iters/s

running (1m19.9s), 003/040 VUs, 3195 complete and 0 interrupted iterations
soak   [  67% ] 003/040 VUs  1m19.9s/2m0s  40.00 iters/s

running (1m20.9s), 005/040 VUs, 3233 complete and 0 interrupted iterations
soak   [  67% ] 005/040 VUs  1m20.9s/2m0s  40.00 iters/s

running (1m21.9s), 016/040 VUs, 3262 complete and 0 interrupted iterations
soak   [  68% ] 016/040 VUs  1m21.9s/2m0s  40.00 iters/s

running (1m22.9s), 001/040 VUs, 3317 complete and 0 interrupted iterations
soak   [  69% ] 001/040 VUs  1m22.9s/2m0s  40.00 iters/s

running (1m23.9s), 001/040 VUs, 3357 complete and 0 interrupted iterations
soak   [  70% ] 001/040 VUs  1m23.9s/2m0s  40.00 iters/s

running (1m24.9s), 001/040 VUs, 3397 complete and 0 interrupted iterations
soak   [  71% ] 001/040 VUs  1m24.9s/2m0s  40.00 iters/s

running (1m25.9s), 001/040 VUs, 3437 complete and 0 interrupted iterations
soak   [  72% ] 001/040 VUs  1m25.9s/2m0s  40.00 iters/s

running (1m26.9s), 001/040 VUs, 3477 complete and 0 interrupted iterations
soak   [  72% ] 001/040 VUs  1m26.9s/2m0s  40.00 iters/s

running (1m27.9s), 001/040 VUs, 3517 complete and 0 interrupted iterations
soak   [  73% ] 001/040 VUs  1m27.9s/2m0s  40.00 iters/s

running (1m28.9s), 004/040 VUs, 3554 complete and 0 interrupted iterations
soak   [  74% ] 004/040 VUs  1m28.9s/2m0s  40.00 iters/s

running (1m29.9s), 006/040 VUs, 3592 complete and 0 interrupted iterations
soak   [  75% ] 006/040 VUs  1m29.9s/2m0s  40.00 iters/s

running (1m30.9s), 001/040 VUs, 3637 complete and 0 interrupted iterations
soak   [  76% ] 001/040 VUs  1m30.9s/2m0s  40.00 iters/s

running (1m31.9s), 002/040 VUs, 3676 complete and 0 interrupted iterations
soak   [  77% ] 002/040 VUs  1m31.9s/2m0s  40.00 iters/s

running (1m32.9s), 001/040 VUs, 3717 complete and 0 interrupted iterations
soak   [  77% ] 001/040 VUs  1m32.9s/2m0s  40.00 iters/s

running (1m33.9s), 001/040 VUs, 3757 complete and 0 interrupted iterations
soak   [  78% ] 001/040 VUs  1m33.9s/2m0s  40.00 iters/s

running (1m34.9s), 001/040 VUs, 3797 complete and 0 interrupted iterations
soak   [  79% ] 001/040 VUs  1m34.9s/2m0s  40.00 iters/s

running (1m35.9s), 001/040 VUs, 3837 complete and 0 interrupted iterations
soak   [  80% ] 001/040 VUs  1m35.9s/2m0s  40.00 iters/s

running (1m36.9s), 001/040 VUs, 3877 complete and 0 interrupted iterations
soak   [  81% ] 001/040 VUs  1m36.9s/2m0s  40.00 iters/s

running (1m37.9s), 002/040 VUs, 3916 complete and 0 interrupted iterations
soak   [  82% ] 002/040 VUs  1m37.9s/2m0s  40.00 iters/s

running (1m38.9s), 013/040 VUs, 3945 complete and 0 interrupted iterations
soak   [  82% ] 013/040 VUs  1m38.9s/2m0s  40.00 iters/s

running (1m39.9s), 001/040 VUs, 3997 complete and 0 interrupted iterations
soak   [  83% ] 001/040 VUs  1m39.9s/2m0s  40.00 iters/s

running (1m40.9s), 001/040 VUs, 4037 complete and 0 interrupted iterations
soak   [  84% ] 001/040 VUs  1m40.9s/2m0s  40.00 iters/s

running (1m41.9s), 001/040 VUs, 4077 complete and 0 interrupted iterations
soak   [  85% ] 001/040 VUs  1m41.9s/2m0s  40.00 iters/s

running (1m42.9s), 001/040 VUs, 4117 complete and 0 interrupted iterations
soak   [  86% ] 001/040 VUs  1m42.9s/2m0s  40.00 iters/s

running (1m43.9s), 001/040 VUs, 4157 complete and 0 interrupted iterations
soak   [  87% ] 001/040 VUs  1m43.9s/2m0s  40.00 iters/s

running (1m44.9s), 001/040 VUs, 4197 complete and 0 interrupted iterations
soak   [  87% ] 001/040 VUs  1m44.9s/2m0s  40.00 iters/s

running (1m45.9s), 001/040 VUs, 4237 complete and 0 interrupted iterations
soak   [  88% ] 001/040 VUs  1m45.9s/2m0s  40.00 iters/s

running (1m46.9s), 002/040 VUs, 4276 complete and 0 interrupted iterations
soak   [  89% ] 002/040 VUs  1m46.9s/2m0s  40.00 iters/s

running (1m47.9s), 004/040 VUs, 4314 complete and 0 interrupted iterations
soak   [  90% ] 004/040 VUs  1m47.9s/2m0s  40.00 iters/s

running (1m48.9s), 001/040 VUs, 4357 complete and 0 interrupted iterations
soak   [  91% ] 001/040 VUs  1m48.9s/2m0s  40.00 iters/s

running (1m49.9s), 001/040 VUs, 4397 complete and 0 interrupted iterations
soak   [  92% ] 001/040 VUs  1m49.9s/2m0s  40.00 iters/s

running (1m50.9s), 001/040 VUs, 4437 complete and 0 interrupted iterations
soak   [  92% ] 001/040 VUs  1m50.9s/2m0s  40.00 iters/s

running (1m51.9s), 001/040 VUs, 4477 complete and 0 interrupted iterations
soak   [  93% ] 001/040 VUs  1m51.9s/2m0s  40.00 iters/s

running (1m52.9s), 001/040 VUs, 4517 complete and 0 interrupted iterations
soak   [  94% ] 001/040 VUs  1m52.9s/2m0s  40.00 iters/s

running (1m53.9s), 002/040 VUs, 4556 complete and 0 interrupted iterations
soak   [  95% ] 002/040 VUs  1m53.9s/2m0s  40.00 iters/s

running (1m54.9s), 002/040 VUs, 4596 complete and 0 interrupted iterations
soak   [  96% ] 002/040 VUs  1m54.9s/2m0s  40.00 iters/s

running (1m55.9s), 001/040 VUs, 4637 complete and 0 interrupted iterations
soak   [  97% ] 001/040 VUs  1m55.9s/2m0s  40.00 iters/s

running (1m56.9s), 001/040 VUs, 4677 complete and 0 interrupted iterations
soak   [  97% ] 001/040 VUs  1m56.9s/2m0s  40.00 iters/s

running (1m57.9s), 001/040 VUs, 4717 complete and 0 interrupted iterations
soak   [  98% ] 001/040 VUs  1m57.9s/2m0s  40.00 iters/s

running (1m58.9s), 001/040 VUs, 4757 complete and 0 interrupted iterations
soak   [  99% ] 001/040 VUs  1m58.9s/2m0s  40.00 iters/s

running (1m59.9s), 002/040 VUs, 4796 complete and 0 interrupted iterations
soak   [ 100% ] 002/040 VUs  1m59.9s/2m0s  40.00 iters/s


  █ THRESHOLDS 

    http_req_duration
    ✓ 'p(95)<1500' p(95)=110.25ms

    http_req_failed
    ✓ 'rate<0.01' rate=0.00%


  █ TOTAL RESULTS 

    checks_total.......: 4841    40.324983/s
    checks_succeeded...: 100.00% 4841 out of 4841
    checks_failed......: 0.00%   0 out of 4841

    ✓ csrf 200
    ✓ submit 202

    HTTP
    http_req_duration..............: avg=33.8ms  min=4.59ms  med=16.11ms max=543.69ms p(90)=65.51ms p(95)=110.25ms
      { expected_response:true }...: avg=33.8ms  min=4.59ms  med=16.11ms max=543.69ms p(90)=65.51ms p(95)=110.25ms
    http_req_failed................: 0.00%  0 out of 4841
    http_reqs......................: 4841   40.324983/s

    EXECUTION
    iteration_duration.............: avg=45.85ms min=19.92ms med=27.98ms max=554.91ms p(90)=78.86ms p(95)=122.82ms
    iterations.....................: 4801   39.991788/s
    vus............................: 2      min=1         max=16
    vus_max........................: 40     min=40        max=40

    NETWORK
    data_received..................: 6.0 MB 50 kB/s
    data_sent......................: 2.1 MB 18 kB/s




running (2m00.0s), 000/040 VUs, 4801 complete and 0 interrupted iterations
soak ✓ [ 100% ] 000/040 VUs  2m0s  40.00 iters/s
