
         /\      Grafana   /‾‾/  
    /\  /  \     |\  __   /  /   
   /  \/    \    | |/ /  /   ‾‾\ 
  /          \   |   (  |  (‾)  |
 / __________ \  |_|\_\  \_____/ 


     execution: local
        script: /k6/k6/submit-soak.js
        output: -

     scenarios: (100.00%) 1 scenario, 120 max VUs, 2m30s max duration (incl. graceful stop):
              * soak: 40.00 iterations/s for 2m0s (maxVUs: 40-120, gracefulStop: 30s)


running (0m00.9s), 001/040 VUs, 36 complete and 0 interrupted iterations
soak   [   1% ] 001/040 VUs  0m00.9s/2m0s  40.00 iters/s

running (0m01.9s), 000/040 VUs, 77 complete and 0 interrupted iterations
soak   [   2% ] 000/040 VUs  0m01.9s/2m0s  40.00 iters/s

running (0m02.9s), 001/040 VUs, 116 complete and 0 interrupted iterations
soak   [   2% ] 001/040 VUs  0m02.9s/2m0s  40.00 iters/s

running (0m03.9s), 000/040 VUs, 157 complete and 0 interrupted iterations
soak   [   3% ] 000/040 VUs  0m03.9s/2m0s  40.00 iters/s

running (0m04.9s), 001/040 VUs, 196 complete and 0 interrupted iterations
soak   [   4% ] 001/040 VUs  0m04.9s/2m0s  40.00 iters/s

running (0m05.9s), 000/040 VUs, 237 complete and 0 interrupted iterations
soak   [   5% ] 000/040 VUs  0m05.9s/2m0s  40.00 iters/s

running (0m06.9s), 000/040 VUs, 277 complete and 0 interrupted iterations
soak   [   6% ] 000/040 VUs  0m06.9s/2m0s  40.00 iters/s

running (0m07.9s), 000/040 VUs, 317 complete and 0 interrupted iterations
soak   [   7% ] 000/040 VUs  0m07.9s/2m0s  40.00 iters/s

running (0m08.9s), 000/040 VUs, 357 complete and 0 interrupted iterations
soak   [   7% ] 000/040 VUs  0m08.9s/2m0s  40.00 iters/s

running (0m09.9s), 001/040 VUs, 396 complete and 0 interrupted iterations
soak   [   8% ] 001/040 VUs  0m09.9s/2m0s  40.00 iters/s

running (0m10.9s), 001/040 VUs, 436 complete and 0 interrupted iterations
soak   [   9% ] 001/040 VUs  0m10.9s/2m0s  40.00 iters/s

running (0m11.9s), 000/040 VUs, 477 complete and 0 interrupted iterations
soak   [  10% ] 000/040 VUs  0m11.9s/2m0s  40.00 iters/s

running (0m12.9s), 000/040 VUs, 517 complete and 0 interrupted iterations
soak   [  11% ] 000/040 VUs  0m12.9s/2m0s  40.00 iters/s

running (0m13.9s), 000/040 VUs, 557 complete and 0 interrupted iterations
soak   [  12% ] 000/040 VUs  0m13.9s/2m0s  40.00 iters/s

running (0m14.9s), 000/040 VUs, 597 complete and 0 interrupted iterations
soak   [  12% ] 000/040 VUs  0m14.9s/2m0s  40.00 iters/s

running (0m15.9s), 001/040 VUs, 636 complete and 0 interrupted iterations
soak   [  13% ] 001/040 VUs  0m15.9s/2m0s  40.00 iters/s

running (0m16.9s), 001/040 VUs, 676 complete and 0 interrupted iterations
soak   [  14% ] 001/040 VUs  0m16.9s/2m0s  40.00 iters/s

running (0m17.9s), 000/040 VUs, 717 complete and 0 interrupted iterations
soak   [  15% ] 000/040 VUs  0m17.9s/2m0s  40.00 iters/s

running (0m18.9s), 000/040 VUs, 757 complete and 0 interrupted iterations
soak   [  16% ] 000/040 VUs  0m18.9s/2m0s  40.00 iters/s

running (0m19.9s), 000/040 VUs, 797 complete and 0 interrupted iterations
soak   [  17% ] 000/040 VUs  0m19.9s/2m0s  40.00 iters/s

running (0m20.9s), 000/040 VUs, 837 complete and 0 interrupted iterations
soak   [  17% ] 000/040 VUs  0m20.9s/2m0s  40.00 iters/s

running (0m21.9s), 000/040 VUs, 877 complete and 0 interrupted iterations
soak   [  18% ] 000/040 VUs  0m21.9s/2m0s  40.00 iters/s

running (0m22.9s), 001/040 VUs, 916 complete and 0 interrupted iterations
soak   [  19% ] 001/040 VUs  0m22.9s/2m0s  40.00 iters/s

running (0m23.9s), 000/040 VUs, 957 complete and 0 interrupted iterations
soak   [  20% ] 000/040 VUs  0m23.9s/2m0s  40.00 iters/s

running (0m24.9s), 000/040 VUs, 997 complete and 0 interrupted iterations
soak   [  21% ] 000/040 VUs  0m24.9s/2m0s  40.00 iters/s

running (0m25.9s), 000/040 VUs, 1037 complete and 0 interrupted iterations
soak   [  22% ] 000/040 VUs  0m25.9s/2m0s  40.00 iters/s

running (0m26.9s), 000/040 VUs, 1077 complete and 0 interrupted iterations
soak   [  22% ] 000/040 VUs  0m26.9s/2m0s  40.00 iters/s

running (0m27.9s), 000/040 VUs, 1117 complete and 0 interrupted iterations
soak   [  23% ] 000/040 VUs  0m27.9s/2m0s  40.00 iters/s

running (0m28.9s), 001/040 VUs, 1156 complete and 0 interrupted iterations
soak   [  24% ] 001/040 VUs  0m28.9s/2m0s  40.00 iters/s

running (0m29.9s), 001/040 VUs, 1196 complete and 0 interrupted iterations
soak   [  25% ] 001/040 VUs  0m29.9s/2m0s  40.00 iters/s

running (0m30.9s), 001/040 VUs, 1236 complete and 0 interrupted iterations
soak   [  26% ] 001/040 VUs  0m30.9s/2m0s  40.00 iters/s

running (0m31.9s), 000/040 VUs, 1277 complete and 0 interrupted iterations
soak   [  27% ] 000/040 VUs  0m31.9s/2m0s  40.00 iters/s

running (0m32.9s), 001/040 VUs, 1316 complete and 0 interrupted iterations
soak   [  27% ] 001/040 VUs  0m32.9s/2m0s  40.00 iters/s

running (0m33.9s), 000/040 VUs, 1357 complete and 0 interrupted iterations
soak   [  28% ] 000/040 VUs  0m33.9s/2m0s  40.00 iters/s

running (0m34.9s), 000/040 VUs, 1397 complete and 0 interrupted iterations
soak   [  29% ] 000/040 VUs  0m34.9s/2m0s  40.00 iters/s

running (0m35.9s), 001/040 VUs, 1436 complete and 0 interrupted iterations
soak   [  30% ] 001/040 VUs  0m35.9s/2m0s  40.00 iters/s

running (0m36.9s), 001/040 VUs, 1476 complete and 0 interrupted iterations
soak   [  31% ] 001/040 VUs  0m36.9s/2m0s  40.00 iters/s

running (0m37.9s), 000/040 VUs, 1517 complete and 0 interrupted iterations
soak   [  32% ] 000/040 VUs  0m37.9s/2m0s  40.00 iters/s

running (0m38.9s), 000/040 VUs, 1557 complete and 0 interrupted iterations
soak   [  32% ] 000/040 VUs  0m38.9s/2m0s  40.00 iters/s

running (0m39.9s), 000/040 VUs, 1597 complete and 0 interrupted iterations
soak   [  33% ] 000/040 VUs  0m39.9s/2m0s  40.00 iters/s

running (0m40.9s), 000/040 VUs, 1637 complete and 0 interrupted iterations
soak   [  34% ] 000/040 VUs  0m40.9s/2m0s  40.00 iters/s

running (0m41.9s), 001/040 VUs, 1676 complete and 0 interrupted iterations
soak   [  35% ] 001/040 VUs  0m41.9s/2m0s  40.00 iters/s

running (0m42.9s), 001/040 VUs, 1716 complete and 0 interrupted iterations
soak   [  36% ] 001/040 VUs  0m42.9s/2m0s  40.00 iters/s

running (0m43.9s), 000/040 VUs, 1757 complete and 0 interrupted iterations
soak   [  37% ] 000/040 VUs  0m43.9s/2m0s  40.00 iters/s

running (0m44.9s), 000/040 VUs, 1797 complete and 0 interrupted iterations
soak   [  37% ] 000/040 VUs  0m44.9s/2m0s  40.00 iters/s

running (0m45.9s), 001/040 VUs, 1836 complete and 0 interrupted iterations
soak   [  38% ] 001/040 VUs  0m45.9s/2m0s  40.00 iters/s

running (0m46.9s), 000/040 VUs, 1877 complete and 0 interrupted iterations
soak   [  39% ] 000/040 VUs  0m46.9s/2m0s  40.00 iters/s

running (0m47.9s), 000/040 VUs, 1917 complete and 0 interrupted iterations
soak   [  40% ] 000/040 VUs  0m47.9s/2m0s  40.00 iters/s

running (0m48.9s), 001/040 VUs, 1956 complete and 0 interrupted iterations
soak   [  41% ] 001/040 VUs  0m48.9s/2m0s  40.00 iters/s

running (0m49.9s), 000/040 VUs, 1997 complete and 0 interrupted iterations
soak   [  42% ] 000/040 VUs  0m49.9s/2m0s  40.00 iters/s

running (0m50.9s), 001/040 VUs, 2036 complete and 0 interrupted iterations
soak   [  42% ] 001/040 VUs  0m50.9s/2m0s  40.00 iters/s

running (0m51.9s), 000/040 VUs, 2077 complete and 0 interrupted iterations
soak   [  43% ] 000/040 VUs  0m51.9s/2m0s  40.00 iters/s

running (0m52.9s), 000/040 VUs, 2117 complete and 0 interrupted iterations
soak   [  44% ] 000/040 VUs  0m52.9s/2m0s  40.00 iters/s

running (0m53.9s), 000/040 VUs, 2157 complete and 0 interrupted iterations
soak   [  45% ] 000/040 VUs  0m53.9s/2m0s  40.00 iters/s

running (0m54.9s), 001/040 VUs, 2196 complete and 0 interrupted iterations
soak   [  46% ] 001/040 VUs  0m54.9s/2m0s  40.00 iters/s

running (0m55.9s), 001/040 VUs, 2236 complete and 0 interrupted iterations
soak   [  47% ] 001/040 VUs  0m55.9s/2m0s  40.00 iters/s

running (0m56.9s), 000/040 VUs, 2277 complete and 0 interrupted iterations
soak   [  47% ] 000/040 VUs  0m56.9s/2m0s  40.00 iters/s

running (0m57.9s), 000/040 VUs, 2317 complete and 0 interrupted iterations
soak   [  48% ] 000/040 VUs  0m57.9s/2m0s  40.00 iters/s

running (0m58.9s), 000/040 VUs, 2357 complete and 0 interrupted iterations
soak   [  49% ] 000/040 VUs  0m58.9s/2m0s  40.00 iters/s

running (0m59.9s), 000/040 VUs, 2397 complete and 0 interrupted iterations
soak   [  50% ] 000/040 VUs  0m59.9s/2m0s  40.00 iters/s

running (1m00.9s), 000/040 VUs, 2437 complete and 0 interrupted iterations
soak   [  51% ] 000/040 VUs  1m00.9s/2m0s  40.00 iters/s

running (1m01.9s), 001/040 VUs, 2476 complete and 0 interrupted iterations
soak   [  52% ] 001/040 VUs  1m01.9s/2m0s  40.00 iters/s

running (1m02.9s), 000/040 VUs, 2517 complete and 0 interrupted iterations
soak   [  52% ] 000/040 VUs  1m02.9s/2m0s  40.00 iters/s

running (1m03.9s), 000/040 VUs, 2557 complete and 0 interrupted iterations
soak   [  53% ] 000/040 VUs  1m03.9s/2m0s  40.00 iters/s

running (1m04.9s), 000/040 VUs, 2597 complete and 0 interrupted iterations
soak   [  54% ] 000/040 VUs  1m04.9s/2m0s  40.00 iters/s

running (1m05.9s), 001/040 VUs, 2636 complete and 0 interrupted iterations
soak   [  55% ] 001/040 VUs  1m05.9s/2m0s  40.00 iters/s

running (1m06.9s), 000/040 VUs, 2677 complete and 0 interrupted iterations
soak   [  56% ] 000/040 VUs  1m06.9s/2m0s  40.00 iters/s

running (1m07.9s), 001/040 VUs, 2716 complete and 0 interrupted iterations
soak   [  57% ] 001/040 VUs  1m07.9s/2m0s  40.00 iters/s

running (1m08.9s), 001/040 VUs, 2756 complete and 0 interrupted iterations
soak   [  57% ] 001/040 VUs  1m08.9s/2m0s  40.00 iters/s

running (1m09.9s), 000/040 VUs, 2797 complete and 0 interrupted iterations
soak   [  58% ] 000/040 VUs  1m09.9s/2m0s  40.00 iters/s

running (1m10.9s), 000/040 VUs, 2837 complete and 0 interrupted iterations
soak   [  59% ] 000/040 VUs  1m10.9s/2m0s  40.00 iters/s

running (1m11.9s), 000/040 VUs, 2877 complete and 0 interrupted iterations
soak   [  60% ] 000/040 VUs  1m11.9s/2m0s  40.00 iters/s

running (1m12.9s), 000/040 VUs, 2917 complete and 0 interrupted iterations
soak   [  61% ] 000/040 VUs  1m12.9s/2m0s  40.00 iters/s

running (1m13.9s), 000/040 VUs, 2957 complete and 0 interrupted iterations
soak   [  62% ] 000/040 VUs  1m13.9s/2m0s  40.00 iters/s

running (1m14.9s), 001/040 VUs, 2996 complete and 0 interrupted iterations
soak   [  62% ] 001/040 VUs  1m14.9s/2m0s  40.00 iters/s

running (1m15.9s), 000/040 VUs, 3037 complete and 0 interrupted iterations
soak   [  63% ] 000/040 VUs  1m15.9s/2m0s  40.00 iters/s

running (1m16.9s), 000/040 VUs, 3077 complete and 0 interrupted iterations
soak   [  64% ] 000/040 VUs  1m16.9s/2m0s  40.00 iters/s

running (1m17.9s), 000/040 VUs, 3117 complete and 0 interrupted iterations
soak   [  65% ] 000/040 VUs  1m17.9s/2m0s  40.00 iters/s

running (1m18.9s), 000/040 VUs, 3157 complete and 0 interrupted iterations
soak   [  66% ] 000/040 VUs  1m18.9s/2m0s  40.00 iters/s

running (1m19.9s), 000/040 VUs, 3197 complete and 0 interrupted iterations
soak   [  67% ] 000/040 VUs  1m19.9s/2m0s  40.00 iters/s

running (1m20.9s), 001/040 VUs, 3236 complete and 0 interrupted iterations
soak   [  67% ] 001/040 VUs  1m20.9s/2m0s  40.00 iters/s

running (1m21.9s), 001/040 VUs, 3276 complete and 0 interrupted iterations
soak   [  68% ] 001/040 VUs  1m21.9s/2m0s  40.00 iters/s

running (1m22.9s), 001/040 VUs, 3316 complete and 0 interrupted iterations
soak   [  69% ] 001/040 VUs  1m22.9s/2m0s  40.00 iters/s

running (1m23.9s), 000/040 VUs, 3357 complete and 0 interrupted iterations
soak   [  70% ] 000/040 VUs  1m23.9s/2m0s  40.00 iters/s

running (1m24.9s), 000/040 VUs, 3397 complete and 0 interrupted iterations
soak   [  71% ] 000/040 VUs  1m24.9s/2m0s  40.00 iters/s

running (1m25.9s), 000/040 VUs, 3437 complete and 0 interrupted iterations
soak   [  72% ] 000/040 VUs  1m25.9s/2m0s  40.00 iters/s

running (1m26.9s), 000/040 VUs, 3477 complete and 0 interrupted iterations
soak   [  72% ] 000/040 VUs  1m26.9s/2m0s  40.00 iters/s

running (1m27.9s), 001/040 VUs, 3516 complete and 0 interrupted iterations
soak   [  73% ] 001/040 VUs  1m27.9s/2m0s  40.00 iters/s

running (1m28.9s), 000/040 VUs, 3557 complete and 0 interrupted iterations
soak   [  74% ] 000/040 VUs  1m28.9s/2m0s  40.00 iters/s

running (1m29.9s), 000/040 VUs, 3597 complete and 0 interrupted iterations
soak   [  75% ] 000/040 VUs  1m29.9s/2m0s  40.00 iters/s

running (1m30.9s), 000/040 VUs, 3637 complete and 0 interrupted iterations
soak   [  76% ] 000/040 VUs  1m30.9s/2m0s  40.00 iters/s

running (1m31.9s), 000/040 VUs, 3677 complete and 0 interrupted iterations
soak   [  77% ] 000/040 VUs  1m31.9s/2m0s  40.00 iters/s

running (1m32.9s), 000/040 VUs, 3717 complete and 0 interrupted iterations
soak   [  77% ] 000/040 VUs  1m32.9s/2m0s  40.00 iters/s

running (1m33.9s), 001/040 VUs, 3756 complete and 0 interrupted iterations
soak   [  78% ] 001/040 VUs  1m33.9s/2m0s  40.00 iters/s

running (1m34.9s), 001/040 VUs, 3796 complete and 0 interrupted iterations
soak   [  79% ] 001/040 VUs  1m34.9s/2m0s  40.00 iters/s

running (1m35.9s), 000/040 VUs, 3837 complete and 0 interrupted iterations
soak   [  80% ] 000/040 VUs  1m35.9s/2m0s  40.00 iters/s

running (1m36.9s), 001/040 VUs, 3876 complete and 0 interrupted iterations
soak   [  81% ] 001/040 VUs  1m36.9s/2m0s  40.00 iters/s

running (1m37.9s), 000/040 VUs, 3917 complete and 0 interrupted iterations
soak   [  82% ] 000/040 VUs  1m37.9s/2m0s  40.00 iters/s

running (1m38.9s), 000/040 VUs, 3957 complete and 0 interrupted iterations
soak   [  82% ] 000/040 VUs  1m38.9s/2m0s  40.00 iters/s

running (1m39.9s), 000/040 VUs, 3997 complete and 0 interrupted iterations
soak   [  83% ] 000/040 VUs  1m39.9s/2m0s  40.00 iters/s

running (1m40.9s), 001/040 VUs, 4036 complete and 0 interrupted iterations
soak   [  84% ] 001/040 VUs  1m40.9s/2m0s  40.00 iters/s

running (1m41.9s), 000/040 VUs, 4077 complete and 0 interrupted iterations
soak   [  85% ] 000/040 VUs  1m41.9s/2m0s  40.00 iters/s

running (1m42.9s), 000/040 VUs, 4117 complete and 0 interrupted iterations
soak   [  86% ] 000/040 VUs  1m42.9s/2m0s  40.00 iters/s

running (1m43.9s), 000/040 VUs, 4157 complete and 0 interrupted iterations
soak   [  87% ] 000/040 VUs  1m43.9s/2m0s  40.00 iters/s

running (1m44.9s), 000/040 VUs, 4197 complete and 0 interrupted iterations
soak   [  87% ] 000/040 VUs  1m44.9s/2m0s  40.00 iters/s

running (1m45.9s), 000/040 VUs, 4237 complete and 0 interrupted iterations
soak   [  88% ] 000/040 VUs  1m45.9s/2m0s  40.00 iters/s

running (1m46.9s), 009/040 VUs, 4268 complete and 0 interrupted iterations
soak   [  89% ] 009/040 VUs  1m46.9s/2m0s  40.00 iters/s

running (1m47.9s), 001/040 VUs, 4316 complete and 0 interrupted iterations
soak   [  90% ] 001/040 VUs  1m47.9s/2m0s  40.00 iters/s

running (1m48.9s), 000/040 VUs, 4357 complete and 0 interrupted iterations
soak   [  91% ] 000/040 VUs  1m48.9s/2m0s  40.00 iters/s

running (1m49.9s), 000/040 VUs, 4397 complete and 0 interrupted iterations
soak   [  92% ] 000/040 VUs  1m49.9s/2m0s  40.00 iters/s

running (1m50.9s), 000/040 VUs, 4437 complete and 0 interrupted iterations
soak   [  92% ] 000/040 VUs  1m50.9s/2m0s  40.00 iters/s

running (1m51.9s), 000/040 VUs, 4477 complete and 0 interrupted iterations
soak   [  93% ] 000/040 VUs  1m51.9s/2m0s  40.00 iters/s

running (1m52.9s), 000/040 VUs, 4517 complete and 0 interrupted iterations
soak   [  94% ] 000/040 VUs  1m52.9s/2m0s  40.00 iters/s

running (1m53.9s), 001/040 VUs, 4556 complete and 0 interrupted iterations
soak   [  95% ] 001/040 VUs  1m53.9s/2m0s  40.00 iters/s

running (1m54.9s), 000/040 VUs, 4597 complete and 0 interrupted iterations
soak   [  96% ] 000/040 VUs  1m54.9s/2m0s  40.00 iters/s

running (1m55.9s), 000/040 VUs, 4637 complete and 0 interrupted iterations
soak   [  97% ] 000/040 VUs  1m55.9s/2m0s  40.00 iters/s

running (1m56.9s), 000/040 VUs, 4677 complete and 0 interrupted iterations
soak   [  97% ] 000/040 VUs  1m56.9s/2m0s  40.00 iters/s

running (1m57.9s), 000/040 VUs, 4717 complete and 0 interrupted iterations
soak   [  98% ] 000/040 VUs  1m57.9s/2m0s  40.00 iters/s

running (1m58.9s), 000/040 VUs, 4757 complete and 0 interrupted iterations
soak   [  99% ] 000/040 VUs  1m58.9s/2m0s  40.00 iters/s

running (1m59.9s), 001/040 VUs, 4796 complete and 0 interrupted iterations
soak   [ 100% ] 001/040 VUs  1m59.9s/2m0s  40.00 iters/s


  █ THRESHOLDS 

    http_req_duration
    ✓ 'p(95)<1500' p(95)=20.88ms

    http_req_failed
    ✓ 'rate<0.01' rate=0.00%


  █ TOTAL RESULTS 

    checks_total.......: 4841    40.331139/s
    checks_succeeded...: 100.00% 4841 out of 4841
    checks_failed......: 0.00%   0 out of 4841

    ✓ csrf 200
    ✓ submit 202

    HTTP
    http_req_duration..............: avg=11.17ms min=2.73ms  med=7.02ms  max=286.36ms p(90)=17.17ms p(95)=20.88ms
      { expected_response:true }...: avg=11.17ms min=2.73ms  med=7.02ms  max=286.36ms p(90)=17.17ms p(95)=20.88ms
    http_req_failed................: 0.00%  0 out of 4841
    http_reqs......................: 4841   40.331139/s

    EXECUTION
    iteration_duration.............: avg=22.37ms min=17.08ms med=17.79ms max=301.69ms p(90)=29.12ms p(95)=33.15ms
    iterations.....................: 4801   39.997892/s
    vus............................: 2      min=0         max=9 
    vus_max........................: 40     min=40        max=40

    NETWORK
    data_received..................: 6.0 MB 50 kB/s
    data_sent......................: 2.1 MB 18 kB/s




running (2m00.0s), 000/040 VUs, 4801 complete and 0 interrupted iterations
soak ✓ [ 100% ] 000/040 VUs  2m0s  40.00 iters/s
