
         /\      Grafana   /‾‾/  
    /\  /  \     |\  __   /  /   
   /  \/    \    | |/ /  /   ‾‾\ 
  /          \   |   (  |  (‾)  |
 / __________ \  |_|\_\  \_____/ 


     execution: local
        script: /k6/k6/submit-soak.js
        output: -

     scenarios: (100.00%) 1 scenario, 120 max VUs, 2m30s max duration (incl. graceful stop):
              * soak: 40.00 iterations/s for 2m0s (maxVUs: 40-120, gracefulStop: 30s)


running (0m01.0s), 001/040 VUs, 38 complete and 0 interrupted iterations
soak   [   1% ] 001/040 VUs  0m01.0s/2m0s  40.00 iters/s

running (0m02.0s), 000/040 VUs, 79 complete and 0 interrupted iterations
soak   [   2% ] 000/040 VUs  0m02.0s/2m0s  40.00 iters/s

running (0m03.0s), 003/040 VUs, 116 complete and 0 interrupted iterations
soak   [   2% ] 003/040 VUs  0m03.0s/2m0s  40.00 iters/s

running (0m04.0s), 001/040 VUs, 158 complete and 0 interrupted iterations
soak   [   3% ] 001/040 VUs  0m04.0s/2m0s  40.00 iters/s

running (0m05.0s), 000/040 VUs, 199 complete and 0 interrupted iterations
soak   [   4% ] 000/040 VUs  0m05.0s/2m0s  40.00 iters/s

running (0m06.0s), 000/040 VUs, 239 complete and 0 interrupted iterations
soak   [   5% ] 000/040 VUs  0m06.0s/2m0s  40.00 iters/s

running (0m07.0s), 001/040 VUs, 278 complete and 0 interrupted iterations
soak   [   6% ] 001/040 VUs  0m07.0s/2m0s  40.00 iters/s

running (0m08.0s), 001/040 VUs, 318 complete and 0 interrupted iterations
soak   [   7% ] 001/040 VUs  0m08.0s/2m0s  40.00 iters/s

running (0m09.0s), 000/040 VUs, 359 complete and 0 interrupted iterations
soak   [   7% ] 000/040 VUs  0m09.0s/2m0s  40.00 iters/s

running (0m10.0s), 001/040 VUs, 398 complete and 0 interrupted iterations
soak   [   8% ] 001/040 VUs  0m10.0s/2m0s  40.00 iters/s

running (0m11.0s), 001/040 VUs, 438 complete and 0 interrupted iterations
soak   [   9% ] 001/040 VUs  0m11.0s/2m0s  40.00 iters/s

running (0m12.0s), 000/040 VUs, 479 complete and 0 interrupted iterations
soak   [  10% ] 000/040 VUs  0m12.0s/2m0s  40.00 iters/s

running (0m13.0s), 001/040 VUs, 518 complete and 0 interrupted iterations
soak   [  11% ] 001/040 VUs  0m13.0s/2m0s  40.00 iters/s

running (0m14.0s), 000/040 VUs, 559 complete and 0 interrupted iterations
soak   [  12% ] 000/040 VUs  0m14.0s/2m0s  40.00 iters/s

running (0m15.0s), 000/040 VUs, 599 complete and 0 interrupted iterations
soak   [  12% ] 000/040 VUs  0m15.0s/2m0s  40.00 iters/s

running (0m16.0s), 000/040 VUs, 639 complete and 0 interrupted iterations
soak   [  13% ] 000/040 VUs  0m16.0s/2m0s  40.00 iters/s

running (0m17.0s), 001/040 VUs, 678 complete and 0 interrupted iterations
soak   [  14% ] 001/040 VUs  0m17.0s/2m0s  40.00 iters/s

running (0m18.0s), 000/040 VUs, 719 complete and 0 interrupted iterations
soak   [  15% ] 000/040 VUs  0m18.0s/2m0s  40.00 iters/s

running (0m19.0s), 000/040 VUs, 759 complete and 0 interrupted iterations
soak   [  16% ] 000/040 VUs  0m19.0s/2m0s  40.00 iters/s

running (0m20.0s), 000/040 VUs, 799 complete and 0 interrupted iterations
soak   [  17% ] 000/040 VUs  0m20.0s/2m0s  40.00 iters/s

running (0m21.0s), 000/040 VUs, 839 complete and 0 interrupted iterations
soak   [  17% ] 000/040 VUs  0m21.0s/2m0s  40.00 iters/s

running (0m22.0s), 000/040 VUs, 879 complete and 0 interrupted iterations
soak   [  18% ] 000/040 VUs  0m22.0s/2m0s  40.00 iters/s

running (0m23.0s), 001/040 VUs, 918 complete and 0 interrupted iterations
soak   [  19% ] 001/040 VUs  0m23.0s/2m0s  40.00 iters/s

running (0m24.0s), 001/040 VUs, 958 complete and 0 interrupted iterations
soak   [  20% ] 001/040 VUs  0m24.0s/2m0s  40.00 iters/s

running (0m25.0s), 001/040 VUs, 998 complete and 0 interrupted iterations
soak   [  21% ] 001/040 VUs  0m25.0s/2m0s  40.00 iters/s

running (0m26.0s), 001/040 VUs, 1038 complete and 0 interrupted iterations
soak   [  22% ] 001/040 VUs  0m26.0s/2m0s  40.00 iters/s

running (0m27.0s), 000/040 VUs, 1079 complete and 0 interrupted iterations
soak   [  22% ] 000/040 VUs  0m27.0s/2m0s  40.00 iters/s

running (0m28.0s), 000/040 VUs, 1119 complete and 0 interrupted iterations
soak   [  23% ] 000/040 VUs  0m28.0s/2m0s  40.00 iters/s

running (0m29.0s), 000/040 VUs, 1159 complete and 0 interrupted iterations
soak   [  24% ] 000/040 VUs  0m29.0s/2m0s  40.00 iters/s

running (0m30.0s), 006/040 VUs, 1193 complete and 0 interrupted iterations
soak   [  25% ] 006/040 VUs  0m30.0s/2m0s  40.00 iters/s

running (0m31.0s), 001/040 VUs, 1238 complete and 0 interrupted iterations
soak   [  26% ] 001/040 VUs  0m31.0s/2m0s  40.00 iters/s

running (0m32.0s), 000/040 VUs, 1279 complete and 0 interrupted iterations
soak   [  27% ] 000/040 VUs  0m32.0s/2m0s  40.00 iters/s

running (0m33.0s), 000/040 VUs, 1319 complete and 0 interrupted iterations
soak   [  27% ] 000/040 VUs  0m33.0s/2m0s  40.00 iters/s

running (0m34.0s), 000/040 VUs, 1359 complete and 0 interrupted iterations
soak   [  28% ] 000/040 VUs  0m34.0s/2m0s  40.00 iters/s

running (0m35.0s), 001/040 VUs, 1399 complete and 0 interrupted iterations
soak   [  29% ] 001/040 VUs  0m35.0s/2m0s  40.00 iters/s

running (0m36.0s), 000/040 VUs, 1439 complete and 0 interrupted iterations
soak   [  30% ] 000/040 VUs  0m36.0s/2m0s  40.00 iters/s

running (0m37.0s), 001/040 VUs, 1478 complete and 0 interrupted iterations
soak   [  31% ] 001/040 VUs  0m37.0s/2m0s  40.00 iters/s

running (0m38.0s), 000/040 VUs, 1519 complete and 0 interrupted iterations
soak   [  32% ] 000/040 VUs  0m38.0s/2m0s  40.00 iters/s

running (0m39.0s), 001/040 VUs, 1558 complete and 0 interrupted iterations
soak   [  32% ] 001/040 VUs  0m39.0s/2m0s  40.00 iters/s

running (0m40.0s), 000/040 VUs, 1599 complete and 0 interrupted iterations
soak   [  33% ] 000/040 VUs  0m40.0s/2m0s  40.00 iters/s

running (0m41.0s), 000/040 VUs, 1639 complete and 0 interrupted iterations
soak   [  34% ] 000/040 VUs  0m41.0s/2m0s  40.00 iters/s

running (0m42.0s), 000/040 VUs, 1679 complete and 0 interrupted iterations
soak   [  35% ] 000/040 VUs  0m42.0s/2m0s  40.00 iters/s

running (0m43.0s), 001/040 VUs, 1718 complete and 0 interrupted iterations
soak   [  36% ] 001/040 VUs  0m43.0s/2m0s  40.00 iters/s

running (0m44.0s), 001/040 VUs, 1758 complete and 0 interrupted iterations
soak   [  37% ] 001/040 VUs  0m44.0s/2m0s  40.00 iters/s

running (0m45.0s), 000/040 VUs, 1799 complete and 0 interrupted iterations
soak   [  37% ] 000/040 VUs  0m45.0s/2m0s  40.00 iters/s

running (0m46.0s), 000/040 VUs, 1839 complete and 0 interrupted iterations
soak   [  38% ] 000/040 VUs  0m46.0s/2m0s  40.00 iters/s

running (0m47.0s), 000/040 VUs, 1879 complete and 0 interrupted iterations
soak   [  39% ] 000/040 VUs  0m47.0s/2m0s  40.00 iters/s

running (0m48.0s), 000/040 VUs, 1919 complete and 0 interrupted iterations
soak   [  40% ] 000/040 VUs  0m48.0s/2m0s  40.00 iters/s

running (0m49.0s), 000/040 VUs, 1959 complete and 0 interrupted iterations
soak   [  41% ] 000/040 VUs  0m49.0s/2m0s  40.00 iters/s

running (0m50.0s), 001/040 VUs, 1998 complete and 0 interrupted iterations
soak   [  42% ] 001/040 VUs  0m50.0s/2m0s  40.00 iters/s

running (0m51.0s), 000/040 VUs, 2039 complete and 0 interrupted iterations
soak   [  42% ] 000/040 VUs  0m51.0s/2m0s  40.00 iters/s

running (0m52.0s), 000/040 VUs, 2079 complete and 0 interrupted iterations
soak   [  43% ] 000/040 VUs  0m52.0s/2m0s  40.00 iters/s

running (0m53.0s), 001/040 VUs, 2118 complete and 0 interrupted iterations
soak   [  44% ] 000/040 VUs  0m53.0s/2m0s  40.00 iters/s

running (0m54.0s), 000/040 VUs, 2159 complete and 0 interrupted iterations
soak   [  45% ] 000/040 VUs  0m54.0s/2m0s  40.00 iters/s

running (0m55.0s), 000/040 VUs, 2199 complete and 0 interrupted iterations
soak   [  46% ] 000/040 VUs  0m55.0s/2m0s  40.00 iters/s

running (0m56.0s), 001/040 VUs, 2238 complete and 0 interrupted iterations
soak   [  47% ] 001/040 VUs  0m56.0s/2m0s  40.00 iters/s

running (0m57.0s), 001/040 VUs, 2278 complete and 0 interrupted iterations
soak   [  47% ] 001/040 VUs  0m57.0s/2m0s  40.00 iters/s

running (0m58.0s), 000/040 VUs, 2319 complete and 0 interrupted iterations
soak   [  48% ] 000/040 VUs  0m58.0s/2m0s  40.00 iters/s

running (0m59.0s), 000/040 VUs, 2359 complete and 0 interrupted iterations
soak   [  49% ] 000/040 VUs  0m59.0s/2m0s  40.00 iters/s

running (1m00.0s), 000/040 VUs, 2399 complete and 0 interrupted iterations
soak   [  50% ] 000/040 VUs  1m00.0s/2m0s  40.00 iters/s

running (1m01.0s), 000/040 VUs, 2439 complete and 0 interrupted iterations
soak   [  51% ] 000/040 VUs  1m01.0s/2m0s  40.00 iters/s

running (1m02.0s), 000/040 VUs, 2479 complete and 0 interrupted iterations
soak   [  52% ] 000/040 VUs  1m02.0s/2m0s  40.00 iters/s

running (1m03.0s), 001/040 VUs, 2518 complete and 0 interrupted iterations
soak   [  52% ] 001/040 VUs  1m03.0s/2m0s  40.00 iters/s

running (1m04.0s), 000/040 VUs, 2559 complete and 0 interrupted iterations
soak   [  53% ] 000/040 VUs  1m04.0s/2m0s  40.00 iters/s

running (1m05.0s), 000/040 VUs, 2599 complete and 0 interrupted iterations
soak   [  54% ] 000/040 VUs  1m05.0s/2m0s  40.00 iters/s

running (1m06.0s), 000/040 VUs, 2639 complete and 0 interrupted iterations
soak   [  55% ] 000/040 VUs  1m06.0s/2m0s  40.00 iters/s

running (1m07.0s), 000/040 VUs, 2679 complete and 0 interrupted iterations
soak   [  56% ] 000/040 VUs  1m07.0s/2m0s  40.00 iters/s

running (1m08.0s), 000/040 VUs, 2719 complete and 0 interrupted iterations
soak   [  57% ] 000/040 VUs  1m08.0s/2m0s  40.00 iters/s

running (1m09.0s), 001/040 VUs, 2758 complete and 0 interrupted iterations
soak   [  57% ] 001/040 VUs  1m09.0s/2m0s  40.00 iters/s

running (1m10.0s), 001/040 VUs, 2798 complete and 0 interrupted iterations
soak   [  58% ] 001/040 VUs  1m10.0s/2m0s  40.00 iters/s

running (1m11.0s), 000/040 VUs, 2839 complete and 0 interrupted iterations
soak   [  59% ] 000/040 VUs  1m11.0s/2m0s  40.00 iters/s

running (1m12.0s), 000/040 VUs, 2879 complete and 0 interrupted iterations
soak   [  60% ] 000/040 VUs  1m12.0s/2m0s  40.00 iters/s

running (1m13.0s), 000/040 VUs, 2919 complete and 0 interrupted iterations
soak   [  61% ] 000/040 VUs  1m13.0s/2m0s  40.00 iters/s

running (1m14.0s), 000/040 VUs, 2959 complete and 0 interrupted iterations
soak   [  62% ] 000/040 VUs  1m14.0s/2m0s  40.00 iters/s

running (1m15.0s), 000/040 VUs, 2999 complete and 0 interrupted iterations
soak   [  62% ] 000/040 VUs  1m15.0s/2m0s  40.00 iters/s

running (1m16.0s), 001/040 VUs, 3038 complete and 0 interrupted iterations
soak   [  63% ] 001/040 VUs  1m16.0s/2m0s  40.00 iters/s

running (1m17.0s), 000/040 VUs, 3079 complete and 0 interrupted iterations
soak   [  64% ] 000/040 VUs  1m17.0s/2m0s  40.00 iters/s

running (1m18.0s), 000/040 VUs, 3119 complete and 0 interrupted iterations
soak   [  65% ] 000/040 VUs  1m18.0s/2m0s  40.00 iters/s

running (1m19.0s), 001/040 VUs, 3158 complete and 0 interrupted iterations
soak   [  66% ] 001/040 VUs  1m19.0s/2m0s  40.00 iters/s

running (1m20.0s), 001/040 VUs, 3198 complete and 0 interrupted iterations
soak   [  67% ] 001/040 VUs  1m20.0s/2m0s  40.00 iters/s

running (1m21.0s), 000/040 VUs, 3239 complete and 0 interrupted iterations
soak   [  67% ] 000/040 VUs  1m21.0s/2m0s  40.00 iters/s

running (1m22.0s), 001/040 VUs, 3278 complete and 0 interrupted iterations
soak   [  68% ] 001/040 VUs  1m22.0s/2m0s  40.00 iters/s

running (1m23.0s), 001/040 VUs, 3318 complete and 0 interrupted iterations
soak   [  69% ] 001/040 VUs  1m23.0s/2m0s  40.00 iters/s

running (1m24.0s), 000/040 VUs, 3359 complete and 0 interrupted iterations
soak   [  70% ] 000/040 VUs  1m24.0s/2m0s  40.00 iters/s

running (1m25.0s), 000/040 VUs, 3399 complete and 0 interrupted iterations
soak   [  71% ] 000/040 VUs  1m25.0s/2m0s  40.00 iters/s

running (1m26.0s), 000/040 VUs, 3439 complete and 0 interrupted iterations
soak   [  72% ] 000/040 VUs  1m26.0s/2m0s  40.00 iters/s

running (1m27.0s), 000/040 VUs, 3479 complete and 0 interrupted iterations
soak   [  72% ] 000/040 VUs  1m27.0s/2m0s  40.00 iters/s

running (1m28.0s), 000/040 VUs, 3519 complete and 0 interrupted iterations
soak   [  73% ] 000/040 VUs  1m28.0s/2m0s  40.00 iters/s

running (1m29.0s), 001/040 VUs, 3558 complete and 0 interrupted iterations
soak   [  74% ] 001/040 VUs  1m29.0s/2m0s  40.00 iters/s

running (1m30.0s), 000/040 VUs, 3599 complete and 0 interrupted iterations
soak   [  75% ] 000/040 VUs  1m30.0s/2m0s  40.00 iters/s

running (1m31.0s), 000/040 VUs, 3639 complete and 0 interrupted iterations
soak   [  76% ] 000/040 VUs  1m31.0s/2m0s  40.00 iters/s

running (1m32.0s), 000/040 VUs, 3679 complete and 0 interrupted iterations
soak   [  77% ] 000/040 VUs  1m32.0s/2m0s  40.00 iters/s

running (1m33.0s), 000/040 VUs, 3719 complete and 0 interrupted iterations
soak   [  77% ] 000/040 VUs  1m33.0s/2m0s  40.00 iters/s

running (1m34.0s), 000/040 VUs, 3759 complete and 0 interrupted iterations
soak   [  78% ] 000/040 VUs  1m34.0s/2m0s  40.00 iters/s

running (1m35.0s), 001/040 VUs, 3798 complete and 0 interrupted iterations
soak   [  79% ] 001/040 VUs  1m35.0s/2m0s  40.00 iters/s

running (1m36.0s), 000/040 VUs, 3839 complete and 0 interrupted iterations
soak   [  80% ] 000/040 VUs  1m36.0s/2m0s  40.00 iters/s

running (1m37.0s), 000/040 VUs, 3879 complete and 0 interrupted iterations
soak   [  81% ] 000/040 VUs  1m37.0s/2m0s  40.00 iters/s

running (1m38.0s), 001/040 VUs, 3918 complete and 0 interrupted iterations
soak   [  82% ] 001/040 VUs  1m38.0s/2m0s  40.00 iters/s

running (1m39.0s), 000/040 VUs, 3959 complete and 0 interrupted iterations
soak   [  82% ] 000/040 VUs  1m39.0s/2m0s  40.00 iters/s

running (1m40.0s), 000/040 VUs, 3999 complete and 0 interrupted iterations
soak   [  83% ] 000/040 VUs  1m40.0s/2m0s  40.00 iters/s

running (1m41.0s), 000/040 VUs, 4039 complete and 0 interrupted iterations
soak   [  84% ] 000/040 VUs  1m41.0s/2m0s  40.00 iters/s

running (1m42.0s), 001/040 VUs, 4078 complete and 0 interrupted iterations
soak   [  85% ] 001/040 VUs  1m42.0s/2m0s  40.00 iters/s

running (1m43.0s), 000/040 VUs, 4119 complete and 0 interrupted iterations
soak   [  86% ] 000/040 VUs  1m43.0s/2m0s  40.00 iters/s

running (1m44.0s), 000/040 VUs, 4159 complete and 0 interrupted iterations
soak   [  87% ] 000/040 VUs  1m44.0s/2m0s  40.00 iters/s

running (1m45.0s), 000/040 VUs, 4199 complete and 0 interrupted iterations
soak   [  87% ] 000/040 VUs  1m45.0s/2m0s  40.00 iters/s

running (1m46.0s), 000/040 VUs, 4239 complete and 0 interrupted iterations
soak   [  88% ] 000/040 VUs  1m46.0s/2m0s  40.00 iters/s

running (1m47.0s), 000/040 VUs, 4279 complete and 0 interrupted iterations
soak   [  89% ] 000/040 VUs  1m47.0s/2m0s  40.00 iters/s

running (1m48.0s), 001/040 VUs, 4318 complete and 0 interrupted iterations
soak   [  90% ] 001/040 VUs  1m48.0s/2m0s  40.00 iters/s

running (1m49.0s), 001/040 VUs, 4358 complete and 0 interrupted iterations
soak   [  91% ] 001/040 VUs  1m49.0s/2m0s  40.00 iters/s

running (1m50.0s), 000/040 VUs, 4399 complete and 0 interrupted iterations
soak   [  92% ] 000/040 VUs  1m50.0s/2m0s  40.00 iters/s

running (1m51.0s), 000/040 VUs, 4439 complete and 0 interrupted iterations
soak   [  92% ] 000/040 VUs  1m51.0s/2m0s  40.00 iters/s

running (1m52.0s), 000/040 VUs, 4479 complete and 0 interrupted iterations
soak   [  93% ] 000/040 VUs  1m52.0s/2m0s  40.00 iters/s

running (1m53.0s), 001/040 VUs, 4518 complete and 0 interrupted iterations
soak   [  94% ] 000/040 VUs  1m53.0s/2m0s  40.00 iters/s

running (1m54.0s), 000/040 VUs, 4559 complete and 0 interrupted iterations
soak   [  95% ] 000/040 VUs  1m54.0s/2m0s  40.00 iters/s

running (1m55.0s), 001/040 VUs, 4598 complete and 0 interrupted iterations
soak   [  96% ] 001/040 VUs  1m55.0s/2m0s  40.00 iters/s

running (1m56.0s), 000/040 VUs, 4639 complete and 0 interrupted iterations
soak   [  97% ] 000/040 VUs  1m56.0s/2m0s  40.00 iters/s

running (1m57.0s), 000/040 VUs, 4679 complete and 0 interrupted iterations
soak   [  97% ] 000/040 VUs  1m57.0s/2m0s  40.00 iters/s

running (1m58.0s), 000/040 VUs, 4719 complete and 0 interrupted iterations
soak   [  98% ] 000/040 VUs  1m58.0s/2m0s  40.00 iters/s

running (1m59.0s), 000/040 VUs, 4759 complete and 0 interrupted iterations
soak   [  99% ] 000/040 VUs  1m59.0s/2m0s  40.00 iters/s

running (2m00.0s), 000/040 VUs, 4799 complete and 0 interrupted iterations
soak   [ 100% ] 000/040 VUs  2m00.0s/2m0s  40.00 iters/s


  █ THRESHOLDS 

    http_req_duration
    ✓ 'p(95)<1500' p(95)=26.42ms

    http_req_failed
    ✓ 'rate<0.01' rate=0.00%


  █ TOTAL RESULTS 

    checks_total.......: 4841    40.335418/s
    checks_succeeded...: 100.00% 4841 out of 4841
    checks_failed......: 0.00%   0 out of 4841

    ✓ csrf 200
    ✓ submit 202

    HTTP
    http_req_duration..............: avg=11.78ms min=3.14ms  med=7.6ms  max=159.6ms  p(90)=19.56ms p(95)=26.42ms
      { expected_response:true }...: avg=11.78ms min=3.14ms  med=7.6ms  max=159.6ms  p(90)=19.56ms p(95)=26.42ms
    http_req_failed................: 0.00%  0 out of 4841
    http_reqs......................: 4841   40.335418/s

    EXECUTION
    iteration_duration.............: avg=23.05ms min=17.26ms med=18.4ms max=171.35ms p(90)=31.99ms p(95)=39.06ms
    iterations.....................: 4801   40.002136/s
    vus............................: 0      min=0         max=6 
    vus_max........................: 40     min=40        max=40

    NETWORK
    data_received..................: 6.0 MB 50 kB/s
    data_sent......................: 2.1 MB 18 kB/s




running (2m00.0s), 000/040 VUs, 4801 complete and 0 interrupted iterations
soak ✓ [ 100% ] 000/040 VUs  2m0s  40.00 iters/s
