
         /\      Grafana   /‾‾/  
    /\  /  \     |\  __   /  /   
   /  \/    \    | |/ /  /   ‾‾\ 
  /          \   |   (  |  (‾)  |
 / __________ \  |_|\_\  \_____/ 


     execution: local
        script: /k6/k6/submit-soak.js
        output: -

     scenarios: (100.00%) 1 scenario, 120 max VUs, 2m30s max duration (incl. graceful stop):
              * soak: 40.00 iterations/s for 2m0s (maxVUs: 40-120, gracefulStop: 30s)


running (0m01.0s), 001/040 VUs, 38 complete and 0 interrupted iterations
soak   [   1% ] 001/040 VUs  0m01.0s/2m0s  40.00 iters/s

running (0m02.0s), 002/040 VUs, 77 complete and 0 interrupted iterations
soak   [   2% ] 002/040 VUs  0m02.0s/2m0s  40.00 iters/s

running (0m03.0s), 001/040 VUs, 118 complete and 0 interrupted iterations
soak   [   2% ] 001/040 VUs  0m03.0s/2m0s  40.00 iters/s

running (0m04.0s), 002/040 VUs, 157 complete and 0 interrupted iterations
soak   [   3% ] 002/040 VUs  0m04.0s/2m0s  40.00 iters/s

running (0m05.0s), 002/040 VUs, 197 complete and 0 interrupted iterations
soak   [   4% ] 002/040 VUs  0m05.0s/2m0s  40.00 iters/s

running (0m06.0s), 002/040 VUs, 237 complete and 0 interrupted iterations
soak   [   5% ] 002/040 VUs  0m06.0s/2m0s  40.00 iters/s

running (0m07.0s), 002/040 VUs, 277 complete and 0 interrupted iterations
soak   [   6% ] 002/040 VUs  0m07.0s/2m0s  40.00 iters/s

running (0m08.0s), 002/040 VUs, 317 complete and 0 interrupted iterations
soak   [   7% ] 002/040 VUs  0m08.0s/2m0s  40.00 iters/s

running (0m09.0s), 001/040 VUs, 358 complete and 0 interrupted iterations
soak   [   7% ] 001/040 VUs  0m09.0s/2m0s  40.00 iters/s

running (0m10.0s), 002/040 VUs, 397 complete and 0 interrupted iterations
soak   [   8% ] 002/040 VUs  0m10.0s/2m0s  40.00 iters/s

running (0m11.0s), 003/040 VUs, 436 complete and 0 interrupted iterations
soak   [   9% ] 003/040 VUs  0m11.0s/2m0s  40.00 iters/s

running (0m12.0s), 002/040 VUs, 477 complete and 0 interrupted iterations
soak   [  10% ] 002/040 VUs  0m12.0s/2m0s  40.00 iters/s

running (0m13.0s), 002/040 VUs, 517 complete and 0 interrupted iterations
soak   [  11% ] 002/040 VUs  0m13.0s/2m0s  40.00 iters/s

running (0m14.0s), 002/040 VUs, 557 complete and 0 interrupted iterations
soak   [  12% ] 002/040 VUs  0m14.0s/2m0s  40.00 iters/s

running (0m15.0s), 002/040 VUs, 597 complete and 0 interrupted iterations
soak   [  12% ] 002/040 VUs  0m15.0s/2m0s  40.00 iters/s

running (0m16.0s), 002/040 VUs, 637 complete and 0 interrupted iterations
soak   [  13% ] 002/040 VUs  0m16.0s/2m0s  40.00 iters/s

running (0m17.0s), 002/040 VUs, 677 complete and 0 interrupted iterations
soak   [  14% ] 001/040 VUs  0m17.0s/2m0s  40.00 iters/s

running (0m18.0s), 001/040 VUs, 718 complete and 0 interrupted iterations
soak   [  15% ] 001/040 VUs  0m18.0s/2m0s  40.00 iters/s

running (0m19.0s), 001/040 VUs, 758 complete and 0 interrupted iterations
soak   [  16% ] 001/040 VUs  0m19.0s/2m0s  40.00 iters/s

running (0m20.0s), 001/040 VUs, 798 complete and 0 interrupted iterations
soak   [  17% ] 001/040 VUs  0m20.0s/2m0s  40.00 iters/s

running (0m21.0s), 001/040 VUs, 838 complete and 0 interrupted iterations
soak   [  17% ] 001/040 VUs  0m21.0s/2m0s  40.00 iters/s

running (0m22.0s), 001/040 VUs, 878 complete and 0 interrupted iterations
soak   [  18% ] 001/040 VUs  0m22.0s/2m0s  40.00 iters/s

running (0m23.0s), 001/040 VUs, 918 complete and 0 interrupted iterations
soak   [  19% ] 001/040 VUs  0m23.0s/2m0s  40.00 iters/s

running (0m24.0s), 001/040 VUs, 958 complete and 0 interrupted iterations
soak   [  20% ] 001/040 VUs  0m24.0s/2m0s  40.00 iters/s

running (0m25.0s), 001/040 VUs, 998 complete and 0 interrupted iterations
soak   [  21% ] 001/040 VUs  0m25.0s/2m0s  40.00 iters/s

running (0m26.0s), 001/040 VUs, 1038 complete and 0 interrupted iterations
soak   [  22% ] 001/040 VUs  0m26.0s/2m0s  40.00 iters/s

running (0m27.0s), 001/040 VUs, 1078 complete and 0 interrupted iterations
soak   [  22% ] 001/040 VUs  0m27.0s/2m0s  40.00 iters/s

running (0m28.0s), 001/040 VUs, 1118 complete and 0 interrupted iterations
soak   [  23% ] 001/040 VUs  0m28.0s/2m0s  40.00 iters/s

running (0m29.0s), 001/040 VUs, 1158 complete and 0 interrupted iterations
soak   [  24% ] 001/040 VUs  0m29.0s/2m0s  40.00 iters/s

running (0m30.0s), 001/040 VUs, 1198 complete and 0 interrupted iterations
soak   [  25% ] 001/040 VUs  0m30.0s/2m0s  40.00 iters/s

running (0m31.0s), 006/040 VUs, 1233 complete and 0 interrupted iterations
soak   [  26% ] 006/040 VUs  0m31.0s/2m0s  40.00 iters/s

running (0m32.0s), 001/040 VUs, 1278 complete and 0 interrupted iterations
soak   [  27% ] 001/040 VUs  0m32.0s/2m0s  40.00 iters/s

running (0m33.0s), 001/040 VUs, 1318 complete and 0 interrupted iterations
soak   [  27% ] 001/040 VUs  0m33.0s/2m0s  40.00 iters/s

running (0m34.0s), 001/040 VUs, 1358 complete and 0 interrupted iterations
soak   [  28% ] 001/040 VUs  0m34.0s/2m0s  40.00 iters/s

running (0m35.0s), 001/040 VUs, 1398 complete and 0 interrupted iterations
soak   [  29% ] 001/040 VUs  0m35.0s/2m0s  40.00 iters/s

running (0m36.0s), 001/040 VUs, 1438 complete and 0 interrupted iterations
soak   [  30% ] 001/040 VUs  0m36.0s/2m0s  40.00 iters/s

running (0m37.0s), 002/040 VUs, 1477 complete and 0 interrupted iterations
soak   [  31% ] 002/040 VUs  0m37.0s/2m0s  40.00 iters/s

running (0m38.0s), 002/040 VUs, 1517 complete and 0 interrupted iterations
soak   [  32% ] 002/040 VUs  0m38.0s/2m0s  40.00 iters/s

running (0m39.0s), 001/040 VUs, 1558 complete and 0 interrupted iterations
soak   [  32% ] 001/040 VUs  0m39.0s/2m0s  40.00 iters/s

running (0m40.0s), 001/040 VUs, 1598 complete and 0 interrupted iterations
soak   [  33% ] 001/040 VUs  0m40.0s/2m0s  40.00 iters/s

running (0m41.0s), 001/040 VUs, 1638 complete and 0 interrupted iterations
soak   [  34% ] 001/040 VUs  0m41.0s/2m0s  40.00 iters/s

running (0m42.0s), 001/040 VUs, 1678 complete and 0 interrupted iterations
soak   [  35% ] 001/040 VUs  0m42.0s/2m0s  40.00 iters/s

running (0m43.0s), 001/040 VUs, 1718 complete and 0 interrupted iterations
soak   [  36% ] 001/040 VUs  0m43.0s/2m0s  40.00 iters/s

running (0m44.0s), 006/040 VUs, 1753 complete and 0 interrupted iterations
soak   [  37% ] 006/040 VUs  0m44.0s/2m0s  40.00 iters/s

running (0m45.0s), 001/040 VUs, 1798 complete and 0 interrupted iterations
soak   [  37% ] 001/040 VUs  0m45.0s/2m0s  40.00 iters/s

running (0m46.0s), 001/040 VUs, 1838 complete and 0 interrupted iterations
soak   [  38% ] 001/040 VUs  0m46.0s/2m0s  40.00 iters/s

running (0m47.0s), 001/040 VUs, 1878 complete and 0 interrupted iterations
soak   [  39% ] 001/040 VUs  0m47.0s/2m0s  40.00 iters/s

running (0m48.0s), 001/040 VUs, 1918 complete and 0 interrupted iterations
soak   [  40% ] 001/040 VUs  0m48.0s/2m0s  40.00 iters/s

running (0m49.0s), 001/040 VUs, 1958 complete and 0 interrupted iterations
soak   [  41% ] 001/040 VUs  0m49.0s/2m0s  40.00 iters/s

running (0m50.0s), 001/040 VUs, 1998 complete and 0 interrupted iterations
soak   [  42% ] 001/040 VUs  0m50.0s/2m0s  40.00 iters/s

running (0m51.0s), 001/040 VUs, 2038 complete and 0 interrupted iterations
soak   [  42% ] 001/040 VUs  0m51.0s/2m0s  40.00 iters/s

running (0m52.0s), 002/040 VUs, 2077 complete and 0 interrupted iterations
soak   [  43% ] 002/040 VUs  0m52.0s/2m0s  40.00 iters/s

running (0m53.0s), 001/040 VUs, 2118 complete and 0 interrupted iterations
soak   [  44% ] 001/040 VUs  0m53.0s/2m0s  40.00 iters/s

running (0m54.0s), 001/040 VUs, 2158 complete and 0 interrupted iterations
soak   [  45% ] 001/040 VUs  0m54.0s/2m0s  40.00 iters/s

running (0m55.0s), 001/040 VUs, 2198 complete and 0 interrupted iterations
soak   [  46% ] 001/040 VUs  0m55.0s/2m0s  40.00 iters/s

running (0m56.0s), 001/040 VUs, 2238 complete and 0 interrupted iterations
soak   [  47% ] 001/040 VUs  0m56.0s/2m0s  40.00 iters/s

running (0m57.0s), 001/040 VUs, 2278 complete and 0 interrupted iterations
soak   [  47% ] 001/040 VUs  0m57.0s/2m0s  40.00 iters/s

running (0m58.0s), 001/040 VUs, 2318 complete and 0 interrupted iterations
soak   [  48% ] 001/040 VUs  0m58.0s/2m0s  40.00 iters/s

running (0m59.0s), 001/040 VUs, 2358 complete and 0 interrupted iterations
soak   [  49% ] 001/040 VUs  0m59.0s/2m0s  40.00 iters/s

running (1m00.0s), 001/040 VUs, 2398 complete and 0 interrupted iterations
soak   [  50% ] 001/040 VUs  1m00.0s/2m0s  40.00 iters/s

running (1m01.0s), 001/040 VUs, 2438 complete and 0 interrupted iterations
soak   [  51% ] 001/040 VUs  1m01.0s/2m0s  40.00 iters/s

running (1m02.0s), 001/040 VUs, 2478 complete and 0 interrupted iterations
soak   [  52% ] 001/040 VUs  1m02.0s/2m0s  40.00 iters/s

running (1m03.0s), 001/040 VUs, 2518 complete and 0 interrupted iterations
soak   [  52% ] 001/040 VUs  1m03.0s/2m0s  40.00 iters/s

running (1m04.0s), 001/040 VUs, 2558 complete and 0 interrupted iterations
soak   [  53% ] 001/040 VUs  1m04.0s/2m0s  40.00 iters/s

running (1m05.0s), 001/040 VUs, 2598 complete and 0 interrupted iterations
soak   [  54% ] 001/040 VUs  1m05.0s/2m0s  40.00 iters/s

running (1m06.0s), 001/040 VUs, 2638 complete and 0 interrupted iterations
soak   [  55% ] 001/040 VUs  1m06.0s/2m0s  40.00 iters/s

running (1m07.0s), 001/040 VUs, 2678 complete and 0 interrupted iterations
soak   [  56% ] 001/040 VUs  1m07.0s/2m0s  40.00 iters/s

running (1m08.0s), 001/040 VUs, 2718 complete and 0 interrupted iterations
soak   [  57% ] 001/040 VUs  1m08.0s/2m0s  40.00 iters/s

running (1m09.0s), 001/040 VUs, 2758 complete and 0 interrupted iterations
soak   [  57% ] 001/040 VUs  1m09.0s/2m0s  40.00 iters/s

running (1m10.0s), 001/040 VUs, 2798 complete and 0 interrupted iterations
soak   [  58% ] 001/040 VUs  1m10.0s/2m0s  40.00 iters/s

running (1m11.0s), 001/040 VUs, 2838 complete and 0 interrupted iterations
soak   [  59% ] 001/040 VUs  1m11.0s/2m0s  40.00 iters/s

running (1m12.0s), 001/040 VUs, 2878 complete and 0 interrupted iterations
soak   [  60% ] 001/040 VUs  1m12.0s/2m0s  40.00 iters/s

running (1m13.0s), 001/040 VUs, 2918 complete and 0 interrupted iterations
soak   [  61% ] 001/040 VUs  1m13.0s/2m0s  40.00 iters/s

running (1m14.0s), 001/040 VUs, 2958 complete and 0 interrupted iterations
soak   [  62% ] 001/040 VUs  1m14.0s/2m0s  40.00 iters/s

running (1m15.0s), 001/040 VUs, 2998 complete and 0 interrupted iterations
soak   [  62% ] 001/040 VUs  1m15.0s/2m0s  40.00 iters/s

running (1m16.0s), 001/040 VUs, 3038 complete and 0 interrupted iterations
soak   [  63% ] 001/040 VUs  1m16.0s/2m0s  40.00 iters/s

running (1m17.0s), 001/040 VUs, 3078 complete and 0 interrupted iterations
soak   [  64% ] 001/040 VUs  1m17.0s/2m0s  40.00 iters/s

running (1m18.0s), 001/040 VUs, 3118 complete and 0 interrupted iterations
soak   [  65% ] 001/040 VUs  1m18.0s/2m0s  40.00 iters/s

running (1m19.0s), 001/040 VUs, 3158 complete and 0 interrupted iterations
soak   [  66% ] 001/040 VUs  1m19.0s/2m0s  40.00 iters/s

running (1m20.0s), 001/040 VUs, 3198 complete and 0 interrupted iterations
soak   [  67% ] 001/040 VUs  1m20.0s/2m0s  40.00 iters/s

running (1m21.0s), 001/040 VUs, 3238 complete and 0 interrupted iterations
soak   [  67% ] 001/040 VUs  1m21.0s/2m0s  40.00 iters/s

running (1m22.0s), 001/040 VUs, 3278 complete and 0 interrupted iterations
soak   [  68% ] 001/040 VUs  1m22.0s/2m0s  40.00 iters/s

running (1m23.0s), 001/040 VUs, 3318 complete and 0 interrupted iterations
soak   [  69% ] 001/040 VUs  1m23.0s/2m0s  40.00 iters/s

running (1m24.0s), 001/040 VUs, 3358 complete and 0 interrupted iterations
soak   [  70% ] 001/040 VUs  1m24.0s/2m0s  40.00 iters/s

running (1m25.0s), 001/040 VUs, 3398 complete and 0 interrupted iterations
soak   [  71% ] 001/040 VUs  1m25.0s/2m0s  40.00 iters/s

running (1m26.0s), 001/040 VUs, 3438 complete and 0 interrupted iterations
soak   [  72% ] 001/040 VUs  1m26.0s/2m0s  40.00 iters/s

running (1m27.0s), 001/040 VUs, 3478 complete and 0 interrupted iterations
soak   [  72% ] 001/040 VUs  1m27.0s/2m0s  40.00 iters/s

running (1m28.0s), 001/040 VUs, 3518 complete and 0 interrupted iterations
soak   [  73% ] 001/040 VUs  1m28.0s/2m0s  40.00 iters/s

running (1m29.0s), 001/040 VUs, 3558 complete and 0 interrupted iterations
soak   [  74% ] 001/040 VUs  1m29.0s/2m0s  40.00 iters/s

running (1m30.0s), 001/040 VUs, 3598 complete and 0 interrupted iterations
soak   [  75% ] 001/040 VUs  1m30.0s/2m0s  40.00 iters/s

running (1m31.0s), 001/040 VUs, 3638 complete and 0 interrupted iterations
soak   [  76% ] 001/040 VUs  1m31.0s/2m0s  40.00 iters/s

running (1m32.0s), 001/040 VUs, 3678 complete and 0 interrupted iterations
soak   [  77% ] 001/040 VUs  1m32.0s/2m0s  40.00 iters/s

running (1m33.0s), 001/040 VUs, 3718 complete and 0 interrupted iterations
soak   [  77% ] 001/040 VUs  1m33.0s/2m0s  40.00 iters/s

running (1m34.0s), 001/040 VUs, 3758 complete and 0 interrupted iterations
soak   [  78% ] 001/040 VUs  1m34.0s/2m0s  40.00 iters/s

running (1m35.0s), 001/040 VUs, 3798 complete and 0 interrupted iterations
soak   [  79% ] 001/040 VUs  1m35.0s/2m0s  40.00 iters/s

running (1m36.0s), 001/040 VUs, 3838 complete and 0 interrupted iterations
soak   [  80% ] 001/040 VUs  1m36.0s/2m0s  40.00 iters/s

running (1m37.0s), 001/040 VUs, 3878 complete and 0 interrupted iterations
soak   [  81% ] 001/040 VUs  1m37.0s/2m0s  40.00 iters/s

running (1m38.0s), 001/040 VUs, 3918 complete and 0 interrupted iterations
soak   [  82% ] 001/040 VUs  1m38.0s/2m0s  40.00 iters/s

running (1m39.0s), 001/040 VUs, 3958 complete and 0 interrupted iterations
soak   [  82% ] 001/040 VUs  1m39.0s/2m0s  40.00 iters/s

running (1m40.0s), 001/040 VUs, 3998 complete and 0 interrupted iterations
soak   [  83% ] 001/040 VUs  1m40.0s/2m0s  40.00 iters/s

running (1m41.0s), 002/040 VUs, 4037 complete and 0 interrupted iterations
soak   [  84% ] 002/040 VUs  1m41.0s/2m0s  40.00 iters/s

running (1m42.0s), 001/040 VUs, 4078 complete and 0 interrupted iterations
soak   [  85% ] 001/040 VUs  1m42.0s/2m0s  40.00 iters/s

running (1m43.0s), 001/040 VUs, 4118 complete and 0 interrupted iterations
soak   [  86% ] 001/040 VUs  1m43.0s/2m0s  40.00 iters/s

running (1m44.0s), 001/040 VUs, 4158 complete and 0 interrupted iterations
soak   [  87% ] 001/040 VUs  1m44.0s/2m0s  40.00 iters/s

running (1m45.0s), 001/040 VUs, 4198 complete and 0 interrupted iterations
soak   [  87% ] 001/040 VUs  1m45.0s/2m0s  40.00 iters/s

running (1m46.0s), 001/040 VUs, 4238 complete and 0 interrupted iterations
soak   [  88% ] 001/040 VUs  1m46.0s/2m0s  40.00 iters/s

running (1m47.0s), 001/040 VUs, 4278 complete and 0 interrupted iterations
soak   [  89% ] 001/040 VUs  1m47.0s/2m0s  40.00 iters/s

running (1m48.0s), 001/040 VUs, 4318 complete and 0 interrupted iterations
soak   [  90% ] 001/040 VUs  1m48.0s/2m0s  40.00 iters/s

running (1m49.0s), 001/040 VUs, 4358 complete and 0 interrupted iterations
soak   [  91% ] 001/040 VUs  1m49.0s/2m0s  40.00 iters/s

running (1m50.0s), 001/040 VUs, 4398 complete and 0 interrupted iterations
soak   [  92% ] 001/040 VUs  1m50.0s/2m0s  40.00 iters/s

running (1m51.0s), 001/040 VUs, 4438 complete and 0 interrupted iterations
soak   [  92% ] 001/040 VUs  1m51.0s/2m0s  40.00 iters/s

running (1m52.0s), 001/040 VUs, 4478 complete and 0 interrupted iterations
soak   [  93% ] 001/040 VUs  1m52.0s/2m0s  40.00 iters/s

running (1m53.0s), 001/040 VUs, 4518 complete and 0 interrupted iterations
soak   [  94% ] 001/040 VUs  1m53.0s/2m0s  40.00 iters/s

running (1m54.0s), 001/040 VUs, 4558 complete and 0 interrupted iterations
soak   [  95% ] 001/040 VUs  1m54.0s/2m0s  40.00 iters/s

running (1m55.0s), 001/040 VUs, 4598 complete and 0 interrupted iterations
soak   [  96% ] 001/040 VUs  1m55.0s/2m0s  40.00 iters/s

running (1m56.0s), 001/040 VUs, 4638 complete and 0 interrupted iterations
soak   [  97% ] 001/040 VUs  1m56.0s/2m0s  40.00 iters/s

running (1m57.0s), 001/040 VUs, 4678 complete and 0 interrupted iterations
soak   [  97% ] 001/040 VUs  1m57.0s/2m0s  40.00 iters/s

running (1m58.0s), 001/040 VUs, 4718 complete and 0 interrupted iterations
soak   [  98% ] 001/040 VUs  1m58.0s/2m0s  40.00 iters/s

running (1m59.0s), 001/040 VUs, 4758 complete and 0 interrupted iterations
soak   [  99% ] 001/040 VUs  1m59.0s/2m0s  40.00 iters/s

running (2m00.0s), 001/040 VUs, 4798 complete and 0 interrupted iterations
soak   [ 100% ] 001/040 VUs  2m00.0s/2m0s  40.00 iters/s


  █ THRESHOLDS 

    http_req_duration
    ✓ 'p(95)<1500' p(95)=44ms

    http_req_failed
    ✓ 'rate<0.01' rate=0.00%


  █ TOTAL RESULTS 

    checks_total.......: 4841    40.335149/s
    checks_succeeded...: 100.00% 4841 out of 4841
    checks_failed......: 0.00%   0 out of 4841

    ✓ csrf 200
    ✓ submit 202

    HTTP
    http_req_duration..............: avg=15.26ms min=2.95ms  med=7.44ms  max=180.89ms p(90)=33.09ms p(95)=44ms   
      { expected_response:true }...: avg=15.26ms min=2.95ms  med=7.44ms  max=180.89ms p(90)=33.09ms p(95)=44ms   
    http_req_failed................: 0.00%  0 out of 4841
    http_reqs......................: 4841   40.335149/s

    EXECUTION
    iteration_duration.............: avg=26.72ms min=17.29ms med=18.47ms max=194.02ms p(90)=45.49ms p(95)=56.32ms
    iterations.....................: 4801   40.00187/s
    vus............................: 1      min=1         max=6 
    vus_max........................: 40     min=40        max=40

    NETWORK
    data_received..................: 6.0 MB 50 kB/s
    data_sent......................: 2.1 MB 18 kB/s




running (2m00.0s), 000/040 VUs, 4801 complete and 0 interrupted iterations
soak ✓ [ 100% ] 000/040 VUs  2m0s  40.00 iters/s
