
         /\      Grafana   /‾‾/  
    /\  /  \     |\  __   /  /   
   /  \/    \    | |/ /  /   ‾‾\ 
  /          \   |   (  |  (‾)  |
 / __________ \  |_|\_\  \_____/ 


     execution: local
        script: /k6/k6/submit-step-ramp.js
        output: -

     scenarios: (100.00%) 1 scenario, 800 max VUs, 4m0s max duration (incl. graceful stop):
              * step_ramp: Up to 200.00 iterations/s for 3m30s over 11 stages (maxVUs: 100-800, gracefulStop: 30s)


running (0m00.9s), 000/100 VUs, 0 complete and 0 interrupted iterations
step_ramp   [   0% ] 000/100 VUs  0m00.9s/3m30s  000.71 iters/s

running (0m01.9s), 000/100 VUs, 1 complete and 0 interrupted iterations
step_ramp   [   1% ] 000/100 VUs  0m01.9s/3m30s  001.71 iters/s

running (0m02.9s), 000/100 VUs, 4 complete and 0 interrupted iterations
step_ramp   [   1% ] 000/100 VUs  0m02.9s/3m30s  003.00 iters/s

running (0m03.9s), 000/100 VUs, 7 complete and 0 interrupted iterations
step_ramp   [   2% ] 000/100 VUs  0m03.9s/3m30s  003.87 iters/s

running (0m04.9s), 001/100 VUs, 11 complete and 0 interrupted iterations
step_ramp   [   2% ] 001/100 VUs  0m04.9s/3m30s  005.00 iters/s

running (0m05.9s), 000/100 VUs, 17 complete and 0 interrupted iterations
step_ramp   [   3% ] 000/100 VUs  0m05.9s/3m30s  005.92 iters/s

running (0m06.9s), 001/100 VUs, 23 complete and 0 interrupted iterations
step_ramp   [   3% ] 001/100 VUs  0m06.9s/3m30s  007.00 iters/s

running (0m07.9s), 000/100 VUs, 31 complete and 0 interrupted iterations
step_ramp   [   4% ] 000/100 VUs  0m07.9s/3m30s  007.94 iters/s

running (0m08.9s), 000/100 VUs, 39 complete and 0 interrupted iterations
step_ramp   [   4% ] 000/100 VUs  0m08.9s/3m30s  008.89 iters/s

running (0m09.9s), 000/100 VUs, 49 complete and 0 interrupted iterations
step_ramp   [   5% ] 000/100 VUs  0m09.9s/3m30s  009.95 iters/s

running (0m10.9s), 000/100 VUs, 59 complete and 0 interrupted iterations
step_ramp   [   5% ] 000/100 VUs  0m10.9s/3m30s  010.91 iters/s

running (0m11.9s), 001/100 VUs, 70 complete and 0 interrupted iterations
step_ramp   [   6% ] 000/100 VUs  0m11.9s/3m30s  011.96 iters/s

running (0m12.9s), 000/100 VUs, 83 complete and 0 interrupted iterations
step_ramp   [   6% ] 000/100 VUs  0m12.9s/3m30s  012.92 iters/s

running (0m13.9s), 001/100 VUs, 96 complete and 0 interrupted iterations
step_ramp   [   7% ] 001/100 VUs  0m13.9s/3m30s  013.96 iters/s

running (0m14.9s), 000/100 VUs, 111 complete and 0 interrupted iterations
step_ramp   [   7% ] 000/100 VUs  0m14.9s/3m30s  014.93 iters/s

running (0m15.9s), 000/100 VUs, 126 complete and 0 interrupted iterations
step_ramp   [   8% ] 000/100 VUs  0m15.9s/3m30s  015.91 iters/s

running (0m16.9s), 000/100 VUs, 143 complete and 0 interrupted iterations
step_ramp   [   8% ] 000/100 VUs  0m16.9s/3m30s  016.94 iters/s

running (0m17.9s), 000/100 VUs, 160 complete and 0 interrupted iterations
step_ramp   [   9% ] 000/100 VUs  0m17.9s/3m30s  017.92 iters/s

running (0m18.9s), 000/100 VUs, 179 complete and 0 interrupted iterations
step_ramp   [   9% ] 000/100 VUs  0m18.9s/3m30s  018.95 iters/s

running (0m19.9s), 000/100 VUs, 198 complete and 0 interrupted iterations
step_ramp   [   9% ] 000/100 VUs  0m19.9s/3m30s  019.92 iters/s

running (0m20.9s), 001/100 VUs, 218 complete and 0 interrupted iterations
step_ramp   [  10% ] 001/100 VUs  0m20.9s/3m30s  020.95 iters/s

running (0m21.9s), 000/100 VUs, 240 complete and 0 interrupted iterations
step_ramp   [  10% ] 000/100 VUs  0m21.9s/3m30s  021.93 iters/s

running (0m22.9s), 001/100 VUs, 262 complete and 0 interrupted iterations
step_ramp   [  11% ] 001/100 VUs  0m22.9s/3m30s  022.96 iters/s

running (0m23.9s), 000/100 VUs, 286 complete and 0 interrupted iterations
step_ramp   [  11% ] 000/100 VUs  0m23.9s/3m30s  023.94 iters/s

running (0m24.9s), 000/100 VUs, 310 complete and 0 interrupted iterations
step_ramp   [  12% ] 000/100 VUs  0m24.9s/3m30s  024.92 iters/s

running (0m25.9s), 000/100 VUs, 336 complete and 0 interrupted iterations
step_ramp   [  12% ] 000/100 VUs  0m25.9s/3m30s  025.94 iters/s

running (0m26.9s), 000/100 VUs, 362 complete and 0 interrupted iterations
step_ramp   [  13% ] 000/100 VUs  0m26.9s/3m30s  026.93 iters/s

running (0m27.9s), 001/100 VUs, 389 complete and 0 interrupted iterations
step_ramp   [  13% ] 001/100 VUs  0m27.9s/3m30s  027.95 iters/s

running (0m28.9s), 000/100 VUs, 418 complete and 0 interrupted iterations
step_ramp   [  14% ] 000/100 VUs  0m28.9s/3m30s  028.93 iters/s

running (0m29.9s), 001/100 VUs, 447 complete and 0 interrupted iterations
step_ramp   [  14% ] 001/100 VUs  0m29.9s/3m30s  029.95 iters/s

running (0m30.9s), 000/100 VUs, 478 complete and 0 interrupted iterations
step_ramp   [  15% ] 000/100 VUs  0m30.9s/3m30s  030.94 iters/s

running (0m31.9s), 000/100 VUs, 509 complete and 0 interrupted iterations
step_ramp   [  15% ] 000/100 VUs  0m31.9s/3m30s  031.92 iters/s

running (0m32.9s), 000/100 VUs, 542 complete and 0 interrupted iterations
step_ramp   [  16% ] 000/100 VUs  0m32.9s/3m30s  032.94 iters/s

running (0m33.9s), 000/100 VUs, 575 complete and 0 interrupted iterations
step_ramp   [  16% ] 000/100 VUs  0m33.9s/3m30s  033.93 iters/s

running (0m34.9s), 001/100 VUs, 609 complete and 0 interrupted iterations
step_ramp   [  17% ] 001/100 VUs  0m34.9s/3m30s  034.94 iters/s

running (0m35.9s), 000/100 VUs, 645 complete and 0 interrupted iterations
step_ramp   [  17% ] 000/100 VUs  0m35.9s/3m30s  035.93 iters/s

running (0m36.9s), 001/100 VUs, 681 complete and 0 interrupted iterations
step_ramp   [  18% ] 001/100 VUs  0m36.9s/3m30s  036.95 iters/s

running (0m37.9s), 000/100 VUs, 719 complete and 0 interrupted iterations
step_ramp   [  18% ] 000/100 VUs  0m37.9s/3m30s  037.93 iters/s

running (0m38.9s), 000/100 VUs, 757 complete and 0 interrupted iterations
step_ramp   [  19% ] 000/100 VUs  0m38.9s/3m30s  038.92 iters/s

running (0m39.9s), 000/100 VUs, 797 complete and 0 interrupted iterations
step_ramp   [  19% ] 000/100 VUs  0m39.9s/3m30s  039.94 iters/s

running (0m40.9s), 000/100 VUs, 837 complete and 0 interrupted iterations
step_ramp   [  19% ] 000/100 VUs  0m40.9s/3m30s  040.93 iters/s

running (0m41.9s), 001/100 VUs, 878 complete and 0 interrupted iterations
step_ramp   [  20% ] 001/100 VUs  0m41.9s/3m30s  041.94 iters/s

running (0m42.9s), 000/100 VUs, 921 complete and 0 interrupted iterations
step_ramp   [  20% ] 000/100 VUs  0m42.9s/3m30s  042.93 iters/s

running (0m43.9s), 001/100 VUs, 964 complete and 0 interrupted iterations
step_ramp   [  21% ] 001/100 VUs  0m43.9s/3m30s  043.94 iters/s

running (0m44.9s), 000/100 VUs, 1009 complete and 0 interrupted iterations
step_ramp   [  21% ] 000/100 VUs  0m44.9s/3m30s  044.93 iters/s

running (0m45.9s), 001/100 VUs, 1054 complete and 0 interrupted iterations
step_ramp   [  22% ] 001/100 VUs  0m45.9s/3m30s  045.95 iters/s

running (0m46.9s), 001/100 VUs, 1100 complete and 0 interrupted iterations
step_ramp   [  22% ] 001/100 VUs  0m46.9s/3m30s  046.94 iters/s

running (0m47.9s), 000/100 VUs, 1148 complete and 0 interrupted iterations
step_ramp   [  23% ] 000/100 VUs  0m47.9s/3m30s  047.93 iters/s

running (0m48.9s), 001/100 VUs, 1196 complete and 0 interrupted iterations
step_ramp   [  23% ] 001/100 VUs  0m48.9s/3m30s  048.94 iters/s

running (0m49.9s), 000/100 VUs, 1246 complete and 0 interrupted iterations
step_ramp   [  24% ] 000/100 VUs  0m49.9s/3m30s  049.93 iters/s

running (0m50.9s), 001/100 VUs, 1296 complete and 0 interrupted iterations
step_ramp   [  24% ] 001/100 VUs  0m50.9s/3m30s  050.94 iters/s

running (0m51.9s), 000/100 VUs, 1348 complete and 0 interrupted iterations
step_ramp   [  25% ] 000/100 VUs  0m51.9s/3m30s  051.93 iters/s

running (0m52.9s), 002/100 VUs, 1399 complete and 0 interrupted iterations
step_ramp   [  25% ] 002/100 VUs  0m52.9s/3m30s  052.94 iters/s

running (0m53.9s), 001/100 VUs, 1453 complete and 0 interrupted iterations
step_ramp   [  26% ] 001/100 VUs  0m53.9s/3m30s  053.94 iters/s

running (0m54.9s), 001/100 VUs, 1508 complete and 0 interrupted iterations
step_ramp   [  26% ] 001/100 VUs  0m54.9s/3m30s  054.95 iters/s

running (0m55.9s), 001/100 VUs, 1563 complete and 0 interrupted iterations
step_ramp   [  27% ] 001/100 VUs  0m55.9s/3m30s  055.94 iters/s

running (0m56.9s), 000/100 VUs, 1620 complete and 0 interrupted iterations
step_ramp   [  27% ] 000/100 VUs  0m56.9s/3m30s  056.93 iters/s

running (0m57.9s), 001/100 VUs, 1677 complete and 0 interrupted iterations
step_ramp   [  28% ] 001/100 VUs  0m57.9s/3m30s  057.94 iters/s

running (0m58.9s), 000/100 VUs, 1736 complete and 0 interrupted iterations
step_ramp   [  28% ] 000/100 VUs  0m58.9s/3m30s  058.93 iters/s

running (0m59.9s), 001/100 VUs, 1795 complete and 0 interrupted iterations
step_ramp   [  29% ] 001/100 VUs  0m59.9s/3m30s  059.94 iters/s

running (1m00.9s), 000/100 VUs, 1856 complete and 0 interrupted iterations
step_ramp   [  29% ] 000/100 VUs  1m00.9s/3m30s  060.93 iters/s

running (1m01.9s), 000/100 VUs, 1917 complete and 0 interrupted iterations
step_ramp   [  29% ] 000/100 VUs  1m01.9s/3m30s  061.94 iters/s

running (1m02.9s), 001/100 VUs, 1979 complete and 0 interrupted iterations
step_ramp   [  30% ] 001/100 VUs  1m02.9s/3m30s  062.94 iters/s

running (1m03.9s), 000/100 VUs, 2043 complete and 0 interrupted iterations
step_ramp   [  30% ] 000/100 VUs  1m03.9s/3m30s  063.93 iters/s

running (1m04.9s), 001/100 VUs, 2107 complete and 0 interrupted iterations
step_ramp   [  31% ] 001/100 VUs  1m04.9s/3m30s  064.94 iters/s

running (1m05.9s), 004/100 VUs, 2169 complete and 0 interrupted iterations
step_ramp   [  31% ] 004/100 VUs  1m05.9s/3m30s  065.93 iters/s

running (1m06.9s), 001/100 VUs, 2239 complete and 0 interrupted iterations
step_ramp   [  32% ] 001/100 VUs  1m06.9s/3m30s  066.94 iters/s

running (1m07.9s), 001/100 VUs, 2306 complete and 0 interrupted iterations
step_ramp   [  32% ] 000/100 VUs  1m07.9s/3m30s  067.93 iters/s

running (1m08.9s), 001/100 VUs, 2375 complete and 0 interrupted iterations
step_ramp   [  33% ] 001/100 VUs  1m08.9s/3m30s  068.94 iters/s

running (1m09.9s), 001/100 VUs, 2444 complete and 0 interrupted iterations
step_ramp   [  33% ] 001/100 VUs  1m09.9s/3m30s  069.94 iters/s

running (1m10.9s), 000/100 VUs, 2515 complete and 0 interrupted iterations
step_ramp   [  34% ] 000/100 VUs  1m10.9s/3m30s  070.93 iters/s

running (1m11.9s), 001/100 VUs, 2586 complete and 0 interrupted iterations
step_ramp   [  34% ] 001/100 VUs  1m11.9s/3m30s  071.94 iters/s

running (1m12.9s), 002/100 VUs, 2657 complete and 0 interrupted iterations
step_ramp   [  35% ] 002/100 VUs  1m12.9s/3m30s  072.93 iters/s

running (1m13.9s), 002/100 VUs, 2731 complete and 0 interrupted iterations
step_ramp   [  35% ] 002/100 VUs  1m13.9s/3m30s  073.94 iters/s

running (1m14.9s), 001/100 VUs, 2806 complete and 0 interrupted iterations
step_ramp   [  36% ] 001/100 VUs  1m14.9s/3m30s  074.93 iters/s

running (1m15.9s), 001/100 VUs, 2882 complete and 0 interrupted iterations
step_ramp   [  36% ] 001/100 VUs  1m15.9s/3m30s  075.94 iters/s

running (1m16.9s), 001/100 VUs, 2958 complete and 0 interrupted iterations
step_ramp   [  37% ] 001/100 VUs  1m16.9s/3m30s  076.94 iters/s

running (1m17.9s), 000/100 VUs, 3036 complete and 0 interrupted iterations
step_ramp   [  37% ] 000/100 VUs  1m17.9s/3m30s  077.94 iters/s

running (1m18.9s), 001/100 VUs, 3114 complete and 0 interrupted iterations
step_ramp   [  38% ] 001/100 VUs  1m18.9s/3m30s  078.94 iters/s

running (1m19.9s), 001/100 VUs, 3193 complete and 0 interrupted iterations
step_ramp   [  38% ] 001/100 VUs  1m19.9s/3m30s  079.93 iters/s

running (1m20.9s), 001/100 VUs, 3274 complete and 0 interrupted iterations
step_ramp   [  39% ] 001/100 VUs  1m20.9s/3m30s  080.94 iters/s

running (1m21.9s), 001/100 VUs, 3355 complete and 0 interrupted iterations
step_ramp   [  39% ] 001/100 VUs  1m21.9s/3m30s  081.93 iters/s

running (1m22.9s), 008/100 VUs, 3431 complete and 0 interrupted iterations
step_ramp   [  39% ] 008/100 VUs  1m22.9s/3m30s  082.94 iters/s

running (1m23.9s), 001/100 VUs, 3521 complete and 0 interrupted iterations
step_ramp   [  40% ] 001/100 VUs  1m23.9s/3m30s  083.93 iters/s

running (1m24.9s), 001/100 VUs, 3606 complete and 0 interrupted iterations
step_ramp   [  40% ] 001/100 VUs  1m24.9s/3m30s  084.94 iters/s

running (1m25.9s), 001/100 VUs, 3691 complete and 0 interrupted iterations
step_ramp   [  41% ] 001/100 VUs  1m25.9s/3m30s  085.94 iters/s

running (1m26.9s), 001/100 VUs, 3777 complete and 0 interrupted iterations
step_ramp   [  41% ] 001/100 VUs  1m26.9s/3m30s  086.93 iters/s

running (1m27.9s), 001/100 VUs, 3865 complete and 0 interrupted iterations
step_ramp   [  42% ] 001/100 VUs  1m27.9s/3m30s  087.94 iters/s

running (1m28.9s), 001/100 VUs, 3953 complete and 0 interrupted iterations
step_ramp   [  42% ] 001/100 VUs  1m28.9s/3m30s  088.93 iters/s

running (1m29.9s), 001/100 VUs, 4043 complete and 0 interrupted iterations
step_ramp   [  43% ] 001/100 VUs  1m29.9s/3m30s  089.94 iters/s

running (1m30.9s), 001/100 VUs, 4133 complete and 0 interrupted iterations
step_ramp   [  43% ] 001/100 VUs  1m30.9s/3m30s  090.93 iters/s

running (1m31.9s), 001/100 VUs, 4225 complete and 0 interrupted iterations
step_ramp   [  44% ] 001/100 VUs  1m31.9s/3m30s  091.94 iters/s

running (1m32.9s), 002/100 VUs, 4316 complete and 0 interrupted iterations
step_ramp   [  44% ] 002/100 VUs  1m32.9s/3m30s  092.94 iters/s

running (1m33.9s), 001/100 VUs, 4410 complete and 0 interrupted iterations
step_ramp   [  45% ] 001/100 VUs  1m33.9s/3m30s  093.94 iters/s

running (1m34.9s), 003/100 VUs, 4503 complete and 0 interrupted iterations
step_ramp   [  45% ] 003/100 VUs  1m34.9s/3m30s  094.94 iters/s

running (1m35.9s), 001/100 VUs, 4600 complete and 0 interrupted iterations
step_ramp   [  46% ] 001/100 VUs  1m35.9s/3m30s  095.93 iters/s

running (1m36.9s), 001/100 VUs, 4697 complete and 0 interrupted iterations
step_ramp   [  46% ] 001/100 VUs  1m36.9s/3m30s  096.94 iters/s

running (1m37.9s), 001/100 VUs, 4794 complete and 0 interrupted iterations
step_ramp   [  47% ] 001/100 VUs  1m37.9s/3m30s  097.93 iters/s

running (1m38.9s), 001/100 VUs, 4893 complete and 0 interrupted iterations
step_ramp   [  47% ] 001/100 VUs  1m38.9s/3m30s  098.94 iters/s

running (1m39.9s), 002/100 VUs, 4991 complete and 0 interrupted iterations
step_ramp   [  48% ] 002/100 VUs  1m39.9s/3m30s  099.93 iters/s

running (1m40.9s), 003/100 VUs, 5091 complete and 0 interrupted iterations
step_ramp   [  48% ] 003/100 VUs  1m40.9s/3m30s  100.94 iters/s

running (1m41.9s), 003/100 VUs, 5192 complete and 0 interrupted iterations
step_ramp   [  49% ] 003/100 VUs  1m42.0s/3m30s  101.95 iters/s

running (1m42.9s), 001/100 VUs, 5296 complete and 0 interrupted iterations
step_ramp   [  49% ] 001/100 VUs  1m42.9s/3m30s  102.93 iters/s

running (1m43.9s), 002/100 VUs, 5399 complete and 0 interrupted iterations
step_ramp   [  49% ] 002/100 VUs  1m43.9s/3m30s  103.94 iters/s

running (1m44.9s), 001/100 VUs, 5504 complete and 0 interrupted iterations
step_ramp   [  50% ] 001/100 VUs  1m44.9s/3m30s  104.93 iters/s

running (1m45.9s), 004/100 VUs, 5607 complete and 0 interrupted iterations
step_ramp   [  50% ] 004/100 VUs  1m45.9s/3m30s  105.94 iters/s

running (1m46.9s), 001/100 VUs, 5716 complete and 0 interrupted iterations
step_ramp   [  51% ] 001/100 VUs  1m46.9s/3m30s  106.93 iters/s

running (1m47.9s), 004/100 VUs, 5821 complete and 0 interrupted iterations
step_ramp   [  51% ] 004/100 VUs  1m47.9s/3m30s  107.94 iters/s

running (1m48.9s), 002/100 VUs, 5931 complete and 0 interrupted iterations
step_ramp   [  52% ] 002/100 VUs  1m48.9s/3m30s  108.94 iters/s

running (1m49.9s), 001/100 VUs, 6041 complete and 0 interrupted iterations
step_ramp   [  52% ] 001/100 VUs  1m49.9s/3m30s  109.93 iters/s

running (1m50.9s), 001/100 VUs, 6152 complete and 0 interrupted iterations
step_ramp   [  53% ] 001/100 VUs  1m50.9s/3m30s  110.94 iters/s

running (1m51.9s), 001/100 VUs, 6263 complete and 0 interrupted iterations
step_ramp   [  53% ] 001/100 VUs  1m51.9s/3m30s  111.93 iters/s

running (1m52.9s), 001/100 VUs, 6376 complete and 0 interrupted iterations
step_ramp   [  54% ] 001/100 VUs  1m52.9s/3m30s  112.94 iters/s

running (1m53.9s), 001/100 VUs, 6489 complete and 0 interrupted iterations
step_ramp   [  54% ] 001/100 VUs  1m53.9s/3m30s  113.93 iters/s

running (1m54.9s), 010/100 VUs, 6595 complete and 0 interrupted iterations
step_ramp   [  55% ] 010/100 VUs  1m54.9s/3m30s  114.94 iters/s

running (1m55.9s), 008/100 VUs, 6712 complete and 0 interrupted iterations
step_ramp   [  55% ] 008/100 VUs  1m55.9s/3m30s  115.94 iters/s

running (1m56.9s), 003/100 VUs, 6833 complete and 0 interrupted iterations
step_ramp   [  56% ] 003/100 VUs  1m56.9s/3m30s  116.93 iters/s

running (1m57.9s), 001/100 VUs, 6953 complete and 0 interrupted iterations
step_ramp   [  56% ] 001/100 VUs  1m57.9s/3m30s  117.94 iters/s

running (1m58.9s), 001/100 VUs, 7071 complete and 0 interrupted iterations
step_ramp   [  57% ] 001/100 VUs  1m58.9s/3m30s  118.93 iters/s

running (1m59.9s), 002/100 VUs, 7190 complete and 0 interrupted iterations
step_ramp   [  57% ] 002/100 VUs  1m59.9s/3m30s  119.94 iters/s

running (2m00.9s), 001/100 VUs, 7311 complete and 0 interrupted iterations
step_ramp   [  58% ] 001/100 VUs  2m00.9s/3m30s  120.93 iters/s

running (2m01.9s), 002/100 VUs, 7432 complete and 0 interrupted iterations
step_ramp   [  58% ] 002/100 VUs  2m01.9s/3m30s  121.94 iters/s

running (2m02.9s), 008/100 VUs, 7548 complete and 0 interrupted iterations
step_ramp   [  59% ] 008/100 VUs  2m02.9s/3m30s  122.93 iters/s

running (2m03.9s), 003/100 VUs, 7676 complete and 0 interrupted iterations
step_ramp   [  59% ] 003/100 VUs  2m03.9s/3m30s  123.94 iters/s

running (2m04.9s), 008/100 VUs, 7796 complete and 0 interrupted iterations
step_ramp   [  59% ] 008/100 VUs  2m04.9s/3m30s  124.94 iters/s

running (2m05.9s), 002/100 VUs, 7928 complete and 0 interrupted iterations
step_ramp   [  60% ] 002/100 VUs  2m05.9s/3m30s  125.94 iters/s

running (2m06.9s), 001/100 VUs, 8055 complete and 0 interrupted iterations
step_ramp   [  60% ] 001/100 VUs  2m06.9s/3m30s  126.94 iters/s

running (2m07.9s), 001/100 VUs, 8182 complete and 0 interrupted iterations
step_ramp   [  61% ] 001/100 VUs  2m07.9s/3m30s  127.93 iters/s

running (2m08.9s), 002/100 VUs, 8310 complete and 0 interrupted iterations
step_ramp   [  61% ] 002/100 VUs  2m08.9s/3m30s  128.94 iters/s

running (2m09.9s), 001/100 VUs, 8440 complete and 0 interrupted iterations
step_ramp   [  62% ] 001/100 VUs  2m09.9s/3m30s  129.93 iters/s

running (2m10.9s), 006/100 VUs, 8566 complete and 0 interrupted iterations
step_ramp   [  62% ] 006/100 VUs  2m10.9s/3m30s  130.94 iters/s

running (2m11.9s), 017/100 VUs, 8686 complete and 0 interrupted iterations
step_ramp   [  63% ] 017/100 VUs  2m11.9s/3m30s  131.94 iters/s

running (2m12.9s), 006/100 VUs, 8830 complete and 0 interrupted iterations
step_ramp   [  63% ] 006/100 VUs  2m12.9s/3m30s  132.94 iters/s

running (2m13.9s), 002/100 VUs, 8967 complete and 0 interrupted iterations
step_ramp   [  64% ] 002/100 VUs  2m13.9s/3m30s  133.94 iters/s

running (2m14.9s), 001/100 VUs, 9102 complete and 0 interrupted iterations
step_ramp   [  64% ] 001/100 VUs  2m14.9s/3m30s  134.93 iters/s

running (2m15.9s), 008/100 VUs, 9231 complete and 0 interrupted iterations
step_ramp   [  65% ] 008/100 VUs  2m15.9s/3m30s  135.94 iters/s

running (2m16.9s), 001/100 VUs, 9374 complete and 0 interrupted iterations
step_ramp   [  65% ] 001/100 VUs  2m16.9s/3m30s  136.93 iters/s

running (2m17.9s), 002/100 VUs, 9511 complete and 0 interrupted iterations
step_ramp   [  66% ] 002/100 VUs  2m17.9s/3m30s  137.94 iters/s

running (2m18.9s), 010/100 VUs, 9641 complete and 0 interrupted iterations
step_ramp   [  66% ] 010/100 VUs  2m18.9s/3m30s  138.94 iters/s

running (2m19.9s), 007/100 VUs, 9783 complete and 0 interrupted iterations
step_ramp   [  67% ] 007/100 VUs  2m19.9s/3m30s  139.93 iters/s

running (2m20.9s), 009/100 VUs, 9922 complete and 0 interrupted iterations
step_ramp   [  67% ] 009/100 VUs  2m20.9s/3m30s  140.94 iters/s

running (2m21.9s), 001/100 VUs, 10071 complete and 0 interrupted iterations
step_ramp   [  68% ] 001/100 VUs  2m21.9s/3m30s  141.93 iters/s

running (2m22.9s), 002/100 VUs, 10213 complete and 0 interrupted iterations
step_ramp   [  68% ] 002/100 VUs  2m22.9s/3m30s  142.94 iters/s

running (2m23.9s), 001/100 VUs, 10357 complete and 0 interrupted iterations
step_ramp   [  69% ] 001/100 VUs  2m23.9s/3m30s  143.93 iters/s

running (2m24.9s), 006/100 VUs, 10497 complete and 0 interrupted iterations
step_ramp   [  69% ] 006/100 VUs  2m24.9s/3m30s  144.94 iters/s

running (2m25.9s), 007/100 VUs, 10641 complete and 0 interrupted iterations
step_ramp   [  69% ] 007/100 VUs  2m25.9s/3m30s  145.94 iters/s

running (2m26.9s), 043/100 VUs, 10752 complete and 0 interrupted iterations
step_ramp   [  70% ] 043/100 VUs  2m26.9s/3m30s  146.94 iters/s

running (2m27.9s), 058/100 VUs, 10884 complete and 0 interrupted iterations
step_ramp   [  70% ] 058/100 VUs  2m27.9s/3m30s  147.94 iters/s

running (2m28.9s), 014/100 VUs, 11075 complete and 0 interrupted iterations
step_ramp   [  71% ] 014/100 VUs  2m28.9s/3m30s  148.93 iters/s

running (2m29.9s), 002/100 VUs, 11238 complete and 0 interrupted iterations
step_ramp   [  71% ] 002/100 VUs  2m29.9s/3m30s  149.94 iters/s

running (2m30.9s), 001/100 VUs, 11389 complete and 0 interrupted iterations
step_ramp   [  72% ] 001/100 VUs  2m30.9s/3m30s  150.93 iters/s

running (2m31.9s), 002/100 VUs, 11540 complete and 0 interrupted iterations
step_ramp   [  72% ] 002/100 VUs  2m31.9s/3m30s  151.94 iters/s

running (2m32.9s), 001/100 VUs, 11693 complete and 0 interrupted iterations
step_ramp   [  73% ] 001/100 VUs  2m32.9s/3m30s  152.93 iters/s

running (2m33.9s), 002/100 VUs, 11846 complete and 0 interrupted iterations
step_ramp   [  73% ] 002/100 VUs  2m33.9s/3m30s  153.94 iters/s

running (2m34.9s), 027/100 VUs, 11975 complete and 0 interrupted iterations
step_ramp   [  74% ] 027/100 VUs  2m34.9s/3m30s  154.94 iters/s

running (2m35.9s), 022/100 VUs, 12135 complete and 0 interrupted iterations
step_ramp   [  74% ] 022/100 VUs  2m35.9s/3m30s  155.93 iters/s

running (2m37.0s), 008/100 VUs, 12308 complete and 0 interrupted iterations
step_ramp   [  75% ] 008/100 VUs  2m37.0s/3m30s  156.95 iters/s

running (2m37.9s), 020/100 VUs, 12451 complete and 0 interrupted iterations
step_ramp   [  75% ] 020/100 VUs  2m37.9s/3m30s  157.93 iters/s

running (2m38.9s), 002/100 VUs, 12628 complete and 0 interrupted iterations
step_ramp   [  76% ] 002/100 VUs  2m38.9s/3m30s  158.94 iters/s

running (2m39.9s), 001/100 VUs, 12788 complete and 0 interrupted iterations
step_ramp   [  76% ] 001/100 VUs  2m39.9s/3m30s  159.93 iters/s

running (2m40.9s), 002/100 VUs, 12948 complete and 0 interrupted iterations
step_ramp   [  77% ] 002/100 VUs  2m40.9s/3m30s  160.94 iters/s

running (2m41.9s), 001/100 VUs, 13110 complete and 0 interrupted iterations
step_ramp   [  77% ] 001/100 VUs  2m41.9s/3m30s  161.94 iters/s

running (2m42.9s), 004/100 VUs, 13269 complete and 0 interrupted iterations
step_ramp   [  78% ] 004/100 VUs  2m42.9s/3m30s  162.93 iters/s

running (2m43.9s), 020/100 VUs, 13417 complete and 0 interrupted iterations
step_ramp   [  78% ] 020/100 VUs  2m43.9s/3m30s  163.94 iters/s

running (2m44.9s), 015/100 VUs, 13586 complete and 0 interrupted iterations
step_ramp   [  79% ] 015/100 VUs  2m44.9s/3m30s  164.93 iters/s

running (2m45.9s), 019/100 VUs, 13747 complete and 0 interrupted iterations
step_ramp   [  79% ] 019/100 VUs  2m45.9s/3m30s  165.93 iters/s

running (2m46.9s), 005/100 VUs, 13929 complete and 0 interrupted iterations
step_ramp   [  79% ] 005/100 VUs  2m46.9s/3m30s  166.94 iters/s

running (2m47.9s), 010/100 VUs, 14091 complete and 0 interrupted iterations
step_ramp   [  80% ] 010/100 VUs  2m47.9s/3m30s  167.94 iters/s

running (2m48.9s), 002/100 VUs, 14267 complete and 0 interrupted iterations
step_ramp   [  80% ] 002/100 VUs  2m48.9s/3m30s  168.93 iters/s

running (2m49.9s), 002/100 VUs, 14437 complete and 0 interrupted iterations
step_ramp   [  81% ] 002/100 VUs  2m49.9s/3m30s  169.94 iters/s

running (2m50.9s), 004/100 VUs, 14605 complete and 0 interrupted iterations
step_ramp   [  81% ] 004/100 VUs  2m50.9s/3m30s  170.94 iters/s

running (2m51.9s), 038/100 VUs, 14742 complete and 0 interrupted iterations
step_ramp   [  82% ] 038/100 VUs  2m51.9s/3m30s  171.94 iters/s

running (2m52.9s), 052/100 VUs, 14900 complete and 0 interrupted iterations
step_ramp   [  82% ] 052/100 VUs  2m52.9s/3m30s  172.93 iters/s

running (2m53.9s), 042/100 VUs, 15084 complete and 0 interrupted iterations
step_ramp   [  83% ] 042/100 VUs  2m53.9s/3m30s  173.93 iters/s

running (2m54.9s), 003/100 VUs, 15298 complete and 0 interrupted iterations
step_ramp   [  83% ] 003/100 VUs  2m54.9s/3m30s  174.94 iters/s

running (2m55.9s), 002/100 VUs, 15474 complete and 0 interrupted iterations
step_ramp   [  84% ] 002/100 VUs  2m55.9s/3m30s  175.93 iters/s

running (2m56.9s), 006/100 VUs, 15646 complete and 0 interrupted iterations
step_ramp   [  84% ] 006/100 VUs  2m56.9s/3m30s  176.93 iters/s

running (2m57.9s), 011/100 VUs, 15819 complete and 0 interrupted iterations
step_ramp   [  85% ] 011/100 VUs  2m57.9s/3m30s  177.94 iters/s

running (2m58.9s), 008/100 VUs, 16001 complete and 0 interrupted iterations
step_ramp   [  85% ] 008/100 VUs  2m58.9s/3m30s  178.94 iters/s

running (2m59.9s), 057/100 VUs, 16131 complete and 0 interrupted iterations
step_ramp   [  86% ] 057/100 VUs  2m59.9s/3m30s  179.94 iters/s

running (3m00.9s), 071/100 VUs, 16297 complete and 0 interrupted iterations
step_ramp   [  86% ] 071/100 VUs  3m00.9s/3m30s  180.94 iters/s

running (3m01.9s), 064/100 VUs, 16486 complete and 0 interrupted iterations
step_ramp   [  87% ] 064/100 VUs  3m01.9s/3m30s  181.94 iters/s

running (3m02.9s), 002/100 VUs, 16730 complete and 0 interrupted iterations
step_ramp   [  87% ] 002/100 VUs  3m02.9s/3m30s  182.93 iters/s

running (3m03.9s), 004/100 VUs, 16912 complete and 0 interrupted iterations
step_ramp   [  88% ] 004/100 VUs  3m03.9s/3m30s  183.94 iters/s

running (3m04.9s), 002/100 VUs, 17098 complete and 0 interrupted iterations
step_ramp   [  88% ] 002/100 VUs  3m04.9s/3m30s  184.94 iters/s

running (3m05.9s), 004/100 VUs, 17281 complete and 0 interrupted iterations
step_ramp   [  89% ] 004/100 VUs  3m05.9s/3m30s  185.94 iters/s

running (3m06.9s), 003/100 VUs, 17469 complete and 0 interrupted iterations
step_ramp   [  89% ] 003/100 VUs  3m06.9s/3m30s  186.94 iters/s

running (3m07.9s), 072/100 VUs, 17586 complete and 0 interrupted iterations
step_ramp   [  90% ] 072/100 VUs  3m08.0s/3m30s  187.93 iters/s

running (3m08.9s), 113/118 VUs, 17706 complete and 0 interrupted iterations
step_ramp   [  90% ] 113/118 VUs  3m08.9s/3m30s  188.94 iters/s

running (3m09.9s), 109/125 VUs, 17884 complete and 0 interrupted iterations
step_ramp   [  90% ] 109/125 VUs  3m09.9s/3m30s  189.93 iters/s

running (3m10.9s), 080/134 VUs, 18093 complete and 0 interrupted iterations
step_ramp   [  91% ] 080/134 VUs  3m10.9s/3m30s  190.94 iters/s

running (3m11.9s), 049/134 VUs, 18315 complete and 0 interrupted iterations
step_ramp   [  91% ] 049/134 VUs  3m11.9s/3m30s  191.93 iters/s

running (3m12.9s), 025/134 VUs, 18531 complete and 0 interrupted iterations
step_ramp   [  92% ] 025/134 VUs  3m12.9s/3m30s  192.93 iters/s

running (3m13.9s), 005/134 VUs, 18745 complete and 0 interrupted iterations
step_ramp   [  92% ] 005/134 VUs  3m13.9s/3m30s  193.94 iters/s

running (3m14.9s), 007/134 VUs, 18938 complete and 0 interrupted iterations
step_ramp   [  93% ] 007/134 VUs  3m14.9s/3m30s  194.94 iters/s

running (3m15.9s), 006/134 VUs, 19134 complete and 0 interrupted iterations
step_ramp   [  93% ] 006/134 VUs  3m15.9s/3m30s  195.94 iters/s

running (3m16.9s), 007/134 VUs, 19329 complete and 0 interrupted iterations
step_ramp   [  94% ] 007/134 VUs  3m16.9s/3m30s  196.94 iters/s

running (3m17.9s), 080/134 VUs, 19454 complete and 0 interrupted iterations
step_ramp   [  94% ] 080/134 VUs  3m17.9s/3m30s  197.94 iters/s

running (3m18.9s), 118/148 VUs, 19594 complete and 0 interrupted iterations
step_ramp   [  95% ] 118/148 VUs  3m18.9s/3m30s  198.93 iters/s

running (3m19.9s), 116/161 VUs, 19732 complete and 0 interrupted iterations
step_ramp   [  95% ] 116/161 VUs  3m19.9s/3m30s  199.91 iters/s

running (3m20.9s), 044/161 VUs, 20001 complete and 0 interrupted iterations
step_ramp   [  96% ] 044/161 VUs  3m20.9s/3m30s  181.27 iters/s

running (3m21.9s), 006/161 VUs, 20210 complete and 0 interrupted iterations
step_ramp   [  96% ] 006/161 VUs  3m21.9s/3m30s  161.31 iters/s

running (3m22.9s), 001/161 VUs, 20366 complete and 0 interrupted iterations
step_ramp   [  97% ] 002/161 VUs  3m22.9s/3m30s  141.21 iters/s

running (3m23.9s), 002/161 VUs, 20497 complete and 0 interrupted iterations
step_ramp   [  97% ] 002/161 VUs  3m23.9s/3m30s  121.24 iters/s

running (3m24.9s), 001/161 VUs, 20609 complete and 0 interrupted iterations
step_ramp   [  98% ] 001/161 VUs  3m24.9s/3m30s  101.29 iters/s

running (3m25.9s), 001/161 VUs, 20700 complete and 0 interrupted iterations
step_ramp   [  98% ] 001/161 VUs  3m25.9s/3m30s  081.36 iters/s

running (3m26.9s), 002/161 VUs, 20771 complete and 0 interrupted iterations
step_ramp   [  99% ] 002/161 VUs  3m26.9s/3m30s  061.16 iters/s

running (3m27.9s), 001/161 VUs, 20823 complete and 0 interrupted iterations
step_ramp   [  99% ] 001/161 VUs  3m27.9s/3m30s  041.23 iters/s

running (3m28.9s), 000/161 VUs, 20855 complete and 0 interrupted iterations
step_ramp   [  99% ] 000/161 VUs  3m28.9s/3m30s  021.44 iters/s

running (3m29.9s), 000/161 VUs, 20866 complete and 0 interrupted iterations
step_ramp   [ 100% ] 000/161 VUs  3m29.9s/3m30s  003.16 iters/s


  █ THRESHOLDS 

    http_req_duration
    ✓ 'p(95)<2000' p(95)=391.84ms

    http_req_failed
    ✗ 'rate<0.02' rate=98.46%


  █ TOTAL RESULTS 

    checks_total.......: 21027  100.127206/s
    checks_succeeded...: 1.53%  322 out of 21027
    checks_failed......: 98.46% 20705 out of 21027

    ✗ csrf 200
      ↳  89% — ✓ 161 / ✗ 18
    ✗ submit 202
      ↳  0% — ✓ 161 / ✗ 20687

    HTTP
    http_req_duration..............: avg=78.31ms  min=3.25ms med=9.6ms   max=2s    p(90)=246.81ms p(95)=391.84ms
      { expected_response:true }...: avg=332.89ms min=3.49ms med=12.73ms max=1.97s p(90)=1.59s    p(95)=1.68s   
    http_req_failed................: 98.46% 20705 out of 21027
    http_reqs......................: 21027  100.127206/s

    EXECUTION
    dropped_iterations.............: 133    0.633325/s
    iteration_duration.............: avg=86.08ms  min=8.7ms  med=16.51ms max=2.27s p(90)=254.29ms p(95)=399.24ms
    iterations.....................: 20866  99.360549/s
    vus............................: 0      min=0              max=119
    vus_max........................: 161    min=100            max=161

    NETWORK
    data_received..................: 27 MB  129 kB/s
    data_sent......................: 8.4 MB 40 kB/s




running (3m30.0s), 000/161 VUs, 20866 complete and 0 interrupted iterations
step_ramp ✓ [ 100% ] 000/161 VUs  3m30s  003.16 iters/s
