
         /\      Grafana   /‾‾/  
    /\  /  \     |\  __   /  /   
   /  \/    \    | |/ /  /   ‾‾\ 
  /          \   |   (  |  (‾)  |
 / __________ \  |_|\_\  \_____/ 


     execution: local
        script: tests/k6/k6/submit-soak.js
        output: -

     scenarios: (100.00%) 1 scenario, 1000 max VUs, 1m30s max duration (incl. graceful stop):
              * soak: 2.00 iterations/s for 1m0s (maxVUs: 200-1000, gracefulStop: 30s)


running (0m00.7s), 0000/0200 VUs, 2 complete and 0 interrupted iterations
soak   [   1% ] 0000/0200 VUs  0m00.7s/1m0s  2.00 iters/s

running (0m01.7s), 0000/0200 VUs, 4 complete and 0 interrupted iterations
soak   [   3% ] 0000/0200 VUs  0m01.7s/1m0s  2.00 iters/s

running (0m02.7s), 0000/0200 VUs, 6 complete and 0 interrupted iterations
soak   [   5% ] 0000/0200 VUs  0m02.7s/1m0s  2.00 iters/s

running (0m03.7s), 0000/0200 VUs, 8 complete and 0 interrupted iterations
soak   [   6% ] 0000/0200 VUs  0m03.7s/1m0s  2.00 iters/s

running (0m04.7s), 0000/0200 VUs, 10 complete and 0 interrupted iterations
soak   [   8% ] 0000/0200 VUs  0m04.7s/1m0s  2.00 iters/s

running (0m05.7s), 0000/0200 VUs, 12 complete and 0 interrupted iterations
soak   [  10% ] 0000/0200 VUs  0m05.7s/1m0s  2.00 iters/s

running (0m06.7s), 0000/0200 VUs, 14 complete and 0 interrupted iterations
soak   [  11% ] 0000/0200 VUs  0m06.7s/1m0s  2.00 iters/s

running (0m07.7s), 0000/0200 VUs, 16 complete and 0 interrupted iterations
soak   [  13% ] 0000/0200 VUs  0m07.7s/1m0s  2.00 iters/s

running (0m08.7s), 0000/0200 VUs, 18 complete and 0 interrupted iterations
soak   [  15% ] 0000/0200 VUs  0m08.7s/1m0s  2.00 iters/s

running (0m09.7s), 0000/0200 VUs, 20 complete and 0 interrupted iterations
soak   [  16% ] 0000/0200 VUs  0m09.7s/1m0s  2.00 iters/s

running (0m10.7s), 0000/0200 VUs, 22 complete and 0 interrupted iterations
soak   [  18% ] 0000/0200 VUs  0m10.7s/1m0s  2.00 iters/s

running (0m11.7s), 0000/0200 VUs, 24 complete and 0 interrupted iterations
soak   [  20% ] 0000/0200 VUs  0m11.7s/1m0s  2.00 iters/s

running (0m12.7s), 0000/0200 VUs, 26 complete and 0 interrupted iterations
soak   [  21% ] 0000/0200 VUs  0m12.7s/1m0s  2.00 iters/s

running (0m13.7s), 0000/0200 VUs, 28 complete and 0 interrupted iterations
soak   [  23% ] 0000/0200 VUs  0m13.7s/1m0s  2.00 iters/s

running (0m14.7s), 0000/0200 VUs, 30 complete and 0 interrupted iterations
soak   [  25% ] 0000/0200 VUs  0m14.7s/1m0s  2.00 iters/s

running (0m15.7s), 0000/0200 VUs, 32 complete and 0 interrupted iterations
soak   [  26% ] 0000/0200 VUs  0m15.7s/1m0s  2.00 iters/s

running (0m16.7s), 0000/0200 VUs, 34 complete and 0 interrupted iterations
soak   [  28% ] 0000/0200 VUs  0m16.7s/1m0s  2.00 iters/s

running (0m17.7s), 0000/0200 VUs, 36 complete and 0 interrupted iterations
soak   [  30% ] 0000/0200 VUs  0m17.7s/1m0s  2.00 iters/s

running (0m18.7s), 0000/0200 VUs, 38 complete and 0 interrupted iterations
soak   [  31% ] 0000/0200 VUs  0m18.7s/1m0s  2.00 iters/s

running (0m19.7s), 0000/0200 VUs, 40 complete and 0 interrupted iterations
soak   [  33% ] 0000/0200 VUs  0m19.7s/1m0s  2.00 iters/s

running (0m20.7s), 0000/0200 VUs, 42 complete and 0 interrupted iterations
soak   [  35% ] 0000/0200 VUs  0m20.7s/1m0s  2.00 iters/s

running (0m21.7s), 0000/0200 VUs, 44 complete and 0 interrupted iterations
soak   [  36% ] 0000/0200 VUs  0m21.7s/1m0s  2.00 iters/s

running (0m22.7s), 0000/0200 VUs, 46 complete and 0 interrupted iterations
soak   [  38% ] 0000/0200 VUs  0m22.7s/1m0s  2.00 iters/s

running (0m23.7s), 0000/0200 VUs, 48 complete and 0 interrupted iterations
soak   [  40% ] 0000/0200 VUs  0m23.7s/1m0s  2.00 iters/s

running (0m24.7s), 0000/0200 VUs, 50 complete and 0 interrupted iterations
soak   [  41% ] 0000/0200 VUs  0m24.7s/1m0s  2.00 iters/s

running (0m25.7s), 0000/0200 VUs, 52 complete and 0 interrupted iterations
soak   [  43% ] 0000/0200 VUs  0m25.7s/1m0s  2.00 iters/s

running (0m26.7s), 0000/0200 VUs, 54 complete and 0 interrupted iterations
soak   [  45% ] 0000/0200 VUs  0m26.7s/1m0s  2.00 iters/s

running (0m27.7s), 0000/0200 VUs, 56 complete and 0 interrupted iterations
soak   [  46% ] 0000/0200 VUs  0m27.7s/1m0s  2.00 iters/s

running (0m28.7s), 0000/0200 VUs, 58 complete and 0 interrupted iterations
soak   [  48% ] 0000/0200 VUs  0m28.7s/1m0s  2.00 iters/s

running (0m29.7s), 0000/0200 VUs, 60 complete and 0 interrupted iterations
soak   [  50% ] 0000/0200 VUs  0m29.7s/1m0s  2.00 iters/s

running (0m30.7s), 0000/0200 VUs, 62 complete and 0 interrupted iterations
soak   [  51% ] 0000/0200 VUs  0m30.7s/1m0s  2.00 iters/s

running (0m31.7s), 0000/0200 VUs, 64 complete and 0 interrupted iterations
soak   [  53% ] 0000/0200 VUs  0m31.7s/1m0s  2.00 iters/s

running (0m32.7s), 0000/0200 VUs, 66 complete and 0 interrupted iterations
soak   [  55% ] 0000/0200 VUs  0m32.7s/1m0s  2.00 iters/s

running (0m33.7s), 0000/0200 VUs, 68 complete and 0 interrupted iterations
soak   [  56% ] 0000/0200 VUs  0m33.7s/1m0s  2.00 iters/s

running (0m34.7s), 0000/0200 VUs, 70 complete and 0 interrupted iterations
soak   [  58% ] 0000/0200 VUs  0m34.7s/1m0s  2.00 iters/s

running (0m35.7s), 0000/0200 VUs, 72 complete and 0 interrupted iterations
soak   [  60% ] 0000/0200 VUs  0m35.7s/1m0s  2.00 iters/s

running (0m36.7s), 0000/0200 VUs, 74 complete and 0 interrupted iterations
soak   [  61% ] 0000/0200 VUs  0m36.7s/1m0s  2.00 iters/s

running (0m37.7s), 0000/0200 VUs, 76 complete and 0 interrupted iterations
soak   [  63% ] 0000/0200 VUs  0m37.7s/1m0s  2.00 iters/s

running (0m38.7s), 0000/0200 VUs, 78 complete and 0 interrupted iterations
soak   [  65% ] 0000/0200 VUs  0m38.7s/1m0s  2.00 iters/s

running (0m39.7s), 0000/0200 VUs, 80 complete and 0 interrupted iterations
soak   [  66% ] 0000/0200 VUs  0m39.7s/1m0s  2.00 iters/s

running (0m40.7s), 0000/0200 VUs, 82 complete and 0 interrupted iterations
soak   [  68% ] 0000/0200 VUs  0m40.7s/1m0s  2.00 iters/s

running (0m41.7s), 0000/0200 VUs, 84 complete and 0 interrupted iterations
soak   [  70% ] 0000/0200 VUs  0m41.7s/1m0s  2.00 iters/s

running (0m42.7s), 0000/0200 VUs, 86 complete and 0 interrupted iterations
soak   [  71% ] 0000/0200 VUs  0m42.7s/1m0s  2.00 iters/s

running (0m43.7s), 0000/0200 VUs, 88 complete and 0 interrupted iterations
soak   [  73% ] 0000/0200 VUs  0m43.7s/1m0s  2.00 iters/s

running (0m44.7s), 0000/0200 VUs, 90 complete and 0 interrupted iterations
soak   [  75% ] 0000/0200 VUs  0m44.7s/1m0s  2.00 iters/s

running (0m45.7s), 0000/0200 VUs, 92 complete and 0 interrupted iterations
soak   [  76% ] 0000/0200 VUs  0m45.7s/1m0s  2.00 iters/s

running (0m46.7s), 0000/0200 VUs, 94 complete and 0 interrupted iterations
soak   [  78% ] 0000/0200 VUs  0m46.7s/1m0s  2.00 iters/s

running (0m47.7s), 0000/0200 VUs, 96 complete and 0 interrupted iterations
soak   [  80% ] 0000/0200 VUs  0m47.7s/1m0s  2.00 iters/s

running (0m48.7s), 0000/0200 VUs, 98 complete and 0 interrupted iterations
soak   [  81% ] 0000/0200 VUs  0m48.7s/1m0s  2.00 iters/s

running (0m49.7s), 0000/0200 VUs, 100 complete and 0 interrupted iterations
soak   [  83% ] 0000/0200 VUs  0m49.7s/1m0s  2.00 iters/s

running (0m50.7s), 0000/0200 VUs, 102 complete and 0 interrupted iterations
soak   [  85% ] 0000/0200 VUs  0m50.7s/1m0s  2.00 iters/s

running (0m51.7s), 0000/0200 VUs, 104 complete and 0 interrupted iterations
soak   [  86% ] 0000/0200 VUs  0m51.7s/1m0s  2.00 iters/s

running (0m52.7s), 0000/0200 VUs, 106 complete and 0 interrupted iterations
soak   [  88% ] 0000/0200 VUs  0m52.7s/1m0s  2.00 iters/s

running (0m53.7s), 0000/0200 VUs, 108 complete and 0 interrupted iterations
soak   [  90% ] 0000/0200 VUs  0m53.7s/1m0s  2.00 iters/s

running (0m54.7s), 0000/0200 VUs, 110 complete and 0 interrupted iterations
soak   [  91% ] 0000/0200 VUs  0m54.7s/1m0s  2.00 iters/s

running (0m55.7s), 0000/0200 VUs, 112 complete and 0 interrupted iterations
soak   [  93% ] 0000/0200 VUs  0m55.7s/1m0s  2.00 iters/s

running (0m56.7s), 0000/0200 VUs, 114 complete and 0 interrupted iterations
soak   [  95% ] 0000/0200 VUs  0m56.7s/1m0s  2.00 iters/s

running (0m57.7s), 0000/0200 VUs, 116 complete and 0 interrupted iterations
soak   [  96% ] 0000/0200 VUs  0m57.7s/1m0s  2.00 iters/s

running (0m58.7s), 0000/0200 VUs, 118 complete and 0 interrupted iterations
soak   [  98% ] 0000/0200 VUs  0m58.7s/1m0s  2.00 iters/s

running (0m59.7s), 0000/0200 VUs, 120 complete and 0 interrupted iterations
soak   [ 100% ] 0000/0200 VUs  0m59.7s/1m0s  2.00 iters/s


  █ THRESHOLDS 

    http_req_duration
    ✓ 'p(95)<1500' p(95)=22.88ms

    http_req_failed
    ✓ 'rate<0.01' rate=0.00%


  █ TOTAL RESULTS 

    checks_total.......: 242     4.03083/s
    checks_succeeded...: 100.00% 242 out of 242
    checks_failed......: 0.00%   0 out of 242

    ✓ csrf 200
    ✓ submit 202

    HTTP
    http_req_duration..............: avg=10.44ms min=3.08ms med=8.09ms  max=173.12ms p(90)=16.55ms p(95)=22.88ms
      { expected_response:true }...: avg=10.44ms min=3.08ms med=8.09ms  max=173.12ms p(90)=16.55ms p(95)=22.88ms
    http_req_failed................: 0.00%  0 out of 242
    http_reqs......................: 242    4.03083/s

    EXECUTION
    iteration_duration.............: avg=35ms    min=23.2ms med=26.71ms max=209.71ms p(90)=50.53ms p(95)=77.26ms
    iterations.....................: 121    2.015415/s
    vus............................: 0      min=0        max=0  
    vus_max........................: 200    min=200      max=200

    NETWORK
    data_received..................: 302 kB 5.0 kB/s
    data_sent......................: 63 kB  1.0 kB/s




running (1m00.0s), 0000/0200 VUs, 121 complete and 0 interrupted iterations
soak ✓ [ 100% ] 0000/0200 VUs  1m0s  2.00 iters/s
